play_name,genre,character,act,scene,sentence,text,tokens
Macbeth,Tragedy,Macduff,4,3,44,"For the whole space that's in the tyrant's grasp,","['whole', 'space', 'tyrant', 'grasp']"
Macbeth,Tragedy,Macduff,4,3,45,And the rich East to boot.,"['rich', 'East', 'boot']"
Macbeth,Tragedy,Malcolm,4,3,46,Be not offended:,['offended']
Macbeth,Tragedy,Malcolm,4,3,47,I speak not as in absolute fear of you.,"['speak', 'absolute', 'fear']"
Macbeth,Tragedy,Malcolm,4,3,48,I think our country sinks beneath the yoke;,"['think', 'country', 'sinks', 'beneath', 'yoke']"
Macbeth,Tragedy,Malcolm,4,3,49,"It weeps, it bleeds; and each new day a gash","['weeps', 'bleeds', 'new', 'day', 'gash']"
Macbeth,Tragedy,Malcolm,4,3,50,Is added to her wounds: I think withal,"['added', 'wounds', 'think', 'withal']"
Macbeth,Tragedy,Malcolm,4,3,51,There would be hands uplifted in my right;,"['would', 'hands', 'uplifted', 'right']"
Macbeth,Tragedy,Malcolm,4,3,52,And here from gracious England have I offer,"['gracious', 'England', 'offer']"
Macbeth,Tragedy,Malcolm,4,3,53,"Of goodly thousands: but, for all this,","['goodly', 'thousands']"
Macbeth,Tragedy,Malcolm,4,3,54,"When I shall tread upon the tyrant's head,","['shall', 'tread', 'upon', 'tyrant', 'head']"
Macbeth,Tragedy,Malcolm,4,3,55,"Or wear it on my sword, yet my poor country","['wear', 'sword', 'yet', 'poor', 'country']"
Macbeth,Tragedy,Malcolm,4,3,56,"Shall have more vices than it had before,","['Shall', 'vices']"
Macbeth,Tragedy,Malcolm,4,3,57,"More suffer and more sundry ways than ever,","['suffer', 'sundry', 'ways', 'ever']"
Macbeth,Tragedy,Malcolm,4,3,58,By him that shall succeed.,"['shall', 'succeed']"
Macbeth,Tragedy,Macduff,4,3,59,What should he be?,[]
Macbeth,Tragedy,Malcolm,4,3,60,It is myself I mean: in whom I know,"['mean', 'know']"
Macbeth,Tragedy,Malcolm,4,3,61,All the particulars of vice so grafted,"['particulars', 'vice', 'grafted']"
Macbeth,Tragedy,Malcolm,4,3,62,"That, when they shall be open'd, black Macbeth","['shall', 'open', 'black']"
Macbeth,Tragedy,Malcolm,4,3,63,"Will seem as pure as snow, and the poor state","['seem', 'pure', 'snow', 'poor', 'state']"
Macbeth,Tragedy,Malcolm,4,3,64,"Esteem him as a lamb, being compared","['Esteem', 'lamb', 'compared']"
Macbeth,Tragedy,Malcolm,4,3,65,With my confineless harms.,"['confineless', 'harms']"
Macbeth,Tragedy,Macduff,4,3,66,Not in the legions,['legions']
Macbeth,Tragedy,Macduff,4,3,67,Of horrid hell can come a devil more damn'd,"['horrid', 'hell', 'come', 'devil', 'damn']"
Macbeth,Tragedy,Macduff,4,3,68,In evils to top Macbeth.,"['evils', 'top']"
Macbeth,Tragedy,Malcolm,4,3,69,"I grant him bloody,","['grant', 'bloody']"
Macbeth,Tragedy,Malcolm,4,3,70,"Luxurious, avaricious, false, deceitful,","['Luxurious', 'avaricious', 'false', 'deceitful']"
Macbeth,Tragedy,Malcolm,4,3,71,"Sudden, malicious, smacking of every sin","['Sudden', 'malicious', 'smacking', 'every', 'sin']"
Macbeth,Tragedy,Malcolm,4,3,72,"That has a name: but there's no bottom, none,","['name', 'bottom', 'none']"
Macbeth,Tragedy,Malcolm,4,3,73,"In my voluptuousness: your wives, your daughters,","['voluptuousness', 'wives', 'daughters']"
Macbeth,Tragedy,Malcolm,4,3,74,"Your matrons and your maids, could not fill up","['matrons', 'maids', 'could', 'fill']"
Macbeth,Tragedy,Malcolm,4,3,75,"The cistern of my lust, and my desire","['cistern', 'lust', 'desire']"
Macbeth,Tragedy,Malcolm,4,3,76,All continent impediments would o'erbear,"['continent', 'impediments', 'would', ""o'erbear""]"
Macbeth,Tragedy,Malcolm,4,3,77,That did oppose my will: better Macbeth,"['oppose', 'better']"
Macbeth,Tragedy,Malcolm,4,3,78,Than such an one to reign.,"['one', 'reign']"
Macbeth,Tragedy,Macduff,4,3,79,Boundless intemperance,"['Boundless', 'intemperance']"
Macbeth,Tragedy,Macduff,4,3,80,In nature is a tyranny; it hath been,"['nature', 'tyranny']"
Macbeth,Tragedy,Macduff,4,3,81,The untimely emptying of the happy throne,"['untimely', 'emptying', 'happy', 'throne']"
Macbeth,Tragedy,Macduff,4,3,82,And fall of many kings. But fear not yet,"['fall', 'many', 'kings', 'fear', 'yet']"
Macbeth,Tragedy,Macduff,4,3,83,To take upon you what is yours: you may,"['take', 'upon', 'may']"
Macbeth,Tragedy,Macduff,4,3,84,"Convey your pleasures in a spacious plenty,","['Convey', 'pleasures', 'spacious', 'plenty']"
Macbeth,Tragedy,Macduff,4,3,85,"And yet seem cold, the time you may so hoodwink.","['yet', 'seem', 'cold', 'time', 'may', 'hoodwink']"
Macbeth,Tragedy,Macduff,4,3,86,We have willing dames enough: there cannot be,"['willing', 'dames', 'enough']"
Macbeth,Tragedy,Macduff,4,3,87,"That vulture in you, to devour so many","['vulture', 'devour', 'many']"
Macbeth,Tragedy,Macduff,4,3,88,"As will to greatness dedicate themselves,","['greatness', 'dedicate']"
Macbeth,Tragedy,Macduff,4,3,89,Finding it so inclined.,"['Finding', 'inclined']"
Macbeth,Tragedy,Malcolm,4,3,90,With this there grows,['grows']
Macbeth,Tragedy,Malcolm,4,3,91,In my most ill-composed affection such,"['ill-composed', 'affection']"
Macbeth,Tragedy,Malcolm,4,3,92,"A stanchless avarice that, were I king,","['stanchless', 'avarice', 'king']"
Macbeth,Tragedy,Malcolm,4,3,93,"I should cut off the nobles for their lands,","['cut', 'nobles', 'lands']"
Macbeth,Tragedy,Malcolm,4,3,94,Desire his jewels and this other's house:,"['Desire', 'jewels', 'house']"
Macbeth,Tragedy,Malcolm,4,3,95,And my more-having would be as a sauce,"['more-having', 'would', 'sauce']"
Macbeth,Tragedy,Malcolm,4,3,96,To make me hunger more; that I should forge,"['make', 'hunger', 'forge']"
Macbeth,Tragedy,Malcolm,4,3,97,"Quarrels unjust against the good and loyal,","['Quarrels', 'unjust', 'good', 'loyal']"
Macbeth,Tragedy,Malcolm,4,3,98,Destroying them for wealth.,"['Destroying', 'wealth']"
Macbeth,Tragedy,Macduff,4,3,99,This avarice,['avarice']
Macbeth,Tragedy,Macduff,4,3,100,"Sticks deeper, grows with more pernicious root","['Sticks', 'deeper', 'grows', 'pernicious', 'root']"
Macbeth,Tragedy,Macduff,4,3,101,"Than summer-seeming lust, and it hath been","['summer-seeming', 'lust']"
Macbeth,Tragedy,Macduff,4,3,102,The sword of our slain kings: yet do not fear;,"['sword', 'slain', 'kings', 'yet', 'fear']"
Macbeth,Tragedy,Macduff,4,3,103,Scotland hath foisons to fill up your will.,"['Scotland', 'foisons', 'fill']"
Macbeth,Tragedy,Macduff,4,3,104,"Of your mere own: all these are portable,","['mere', 'portable']"
Macbeth,Tragedy,Macduff,4,3,105,With other graces weigh'd.,"['graces', 'weigh']"
Macbeth,Tragedy,Malcolm,4,3,106,"But I have none: the king-becoming graces,","['none', 'king-becoming', 'graces']"
Macbeth,Tragedy,Malcolm,4,3,107,"As justice, verity, temperance, stableness,","['justice', 'verity', 'temperance', 'stableness']"
Macbeth,Tragedy,Malcolm,4,3,108,"Bounty, perseverance, mercy, lowliness,","['Bounty', 'perseverance', 'mercy', 'lowliness']"
Macbeth,Tragedy,Malcolm,4,3,109,"Devotion, patience, courage, fortitude,","['Devotion', 'patience', 'courage', 'fortitude']"
Macbeth,Tragedy,Malcolm,4,3,110,"I have no relish of them, but abound","['relish', 'abound']"
Macbeth,Tragedy,Malcolm,4,3,111,"In the division of each several crime,","['division', 'several', 'crime']"
Macbeth,Tragedy,Malcolm,4,3,112,"Acting it many ways. Nay, had I power, I should","['Acting', 'many', 'ways', 'Nay', 'power']"
Macbeth,Tragedy,Malcolm,4,3,113,"Pour the sweet milk of concord into hell,","['Pour', 'sweet', 'milk', 'concord', 'hell']"
Macbeth,Tragedy,Malcolm,4,3,114,"Uproar the universal peace, confound","['Uproar', 'universal', 'peace', 'confound']"
Macbeth,Tragedy,Malcolm,4,3,115,All unity on earth.,"['unity', 'earth']"
Macbeth,Tragedy,Macduff,4,3,116,"O Scotland, Scotland!","['Scotland', 'Scotland']"
Macbeth,Tragedy,Malcolm,4,3,117,"If such a one be fit to govern, speak:","['one', 'fit', 'govern', 'speak']"
Macbeth,Tragedy,Malcolm,4,3,118,I am as I have spoken.,['spoken']
Macbeth,Tragedy,Macduff,4,3,119,Fit to govern!,"['Fit', 'govern']"
Macbeth,Tragedy,Macduff,4,3,120,"No, not to live. O nation miserable,","['live', 'nation', 'miserable']"
Macbeth,Tragedy,Macduff,4,3,121,"With an untitled tyrant bloody-scepter'd,","['untitled', 'tyrant', 'bloody-scepter']"
Macbeth,Tragedy,Macduff,4,3,122,"When shalt thou see thy wholesome days again,","['shalt', 'see', 'wholesome', 'days']"
Macbeth,Tragedy,Macduff,4,3,123,Since that the truest issue of thy throne,"['Since', 'truest', 'issue', 'throne']"
Macbeth,Tragedy,Macduff,4,3,124,"By his own interdiction stands accursed,","['interdiction', 'stands', 'accursed']"
Macbeth,Tragedy,Macduff,4,3,125,And does blaspheme his breed? Thy royal father,"['blaspheme', 'breed', 'royal', 'father']"
Macbeth,Tragedy,Macduff,4,3,126,"Was a most sainted king: the queen that bore thee,","['sainted', 'king', 'queen', 'bore']"
Macbeth,Tragedy,Macduff,4,3,127,"Oftener upon her knees than on her feet,","['Oftener', 'upon', 'knees', 'feet']"
Macbeth,Tragedy,Macduff,4,3,128,Died every day she lived. Fare thee well!,"['Died', 'every', 'day', 'lived', 'Fare', 'well']"
Macbeth,Tragedy,Macduff,4,3,129,These evils thou repeat'st upon thyself,"['evils', ""repeat'st"", 'upon', 'thyself']"
Macbeth,Tragedy,Macduff,4,3,130,"Have banish'd me from Scotland. O my breast,","['banish', 'Scotland', 'breast']"
Macbeth,Tragedy,Macduff,4,3,131,Thy hope ends here!,"['hope', 'ends']"
Macbeth,Tragedy,Malcolm,4,3,132,"Macduff, this noble passion,","['noble', 'passion']"
Macbeth,Tragedy,Malcolm,4,3,133,"Child of integrity, hath from my soul","['Child', 'integrity', 'soul']"
Macbeth,Tragedy,Malcolm,4,3,134,"Wiped the black scruples, reconciled my thoughts","['Wiped', 'black', 'scruples', 'reconciled', 'thoughts']"
Macbeth,Tragedy,Malcolm,4,3,135,To thy good truth and honour. Devilish Macbeth,"['good', 'truth', 'honour', 'Devilish']"
Macbeth,Tragedy,Malcolm,4,3,136,By many of these trains hath sought to win me,"['many', 'trains', 'sought', 'win']"
Macbeth,Tragedy,Malcolm,4,3,137,"Into his power, and modest wisdom plucks me","['power', 'modest', 'wisdom', 'plucks']"
Macbeth,Tragedy,Malcolm,4,3,138,From over-credulous haste: but God above,"['over-credulous', 'haste', 'God']"
Macbeth,Tragedy,Malcolm,4,3,139,Deal between thee and me! for even now,"['Deal', 'even']"
Macbeth,Tragedy,Malcolm,4,3,140,"I put myself to thy direction, and","['put', 'direction']"
Macbeth,Tragedy,Malcolm,4,3,141,"Unspeak mine own detraction, here abjure","['Unspeak', 'detraction', 'abjure']"
Macbeth,Tragedy,Malcolm,4,3,142,"The taints and blames I laid upon myself,","['taints', 'blames', 'laid', 'upon']"
Macbeth,Tragedy,Malcolm,4,3,143,For strangers to my nature. I am yet,"['strangers', 'nature', 'yet']"
Macbeth,Tragedy,Malcolm,4,3,144,"Unknown to woman, never was forsworn,","['Unknown', 'woman', 'never', 'forsworn']"
Macbeth,Tragedy,Malcolm,4,3,145,"Scarcely have coveted what was mine own,","['Scarcely', 'coveted']"
Macbeth,Tragedy,Malcolm,4,3,146,"At no time broke my faith, would not betray","['time', 'broke', 'faith', 'would', 'betray']"
Macbeth,Tragedy,Malcolm,4,3,147,The devil to his fellow and delight,"['devil', 'fellow', 'delight']"
Macbeth,Tragedy,Malcolm,4,3,148,No less in truth than life: my first false speaking,"['less', 'truth', 'life', 'first', 'false', 'speaking']"
Macbeth,Tragedy,Malcolm,4,3,149,"Was this upon myself: what I am truly,","['upon', 'truly']"
Macbeth,Tragedy,Malcolm,4,3,150,Is thine and my poor country's to command:,"['poor', 'country', 'command']"
Macbeth,Tragedy,Malcolm,4,3,151,"Whither indeed, before thy here-approach,","['Whither', 'indeed', 'here-approach']"
Macbeth,Tragedy,Malcolm,4,3,152,"Old Siward, with ten thousand warlike men,","['Old', 'ten', 'thousand', 'warlike', 'men']"
Macbeth,Tragedy,Malcolm,4,3,153,"Already at a point, was setting forth.","['Already', 'point', 'setting', 'forth']"
Macbeth,Tragedy,Malcolm,4,3,154,Now we'll together; and the chance of goodness,"['together', 'chance', 'goodness']"
Macbeth,Tragedy,Malcolm,4,3,155,Be like our warranted quarrel! Why are you silent?,"['like', 'warranted', 'quarrel', 'silent']"
Macbeth,Tragedy,Macduff,4,3,156,Such welcome and unwelcome things at once,"['welcome', 'unwelcome', 'things']"
Macbeth,Tragedy,Macduff,4,3,157,'Tis hard to reconcile.,"[""'T"", 'hard', 'reconcile']"
Macbeth,Tragedy,Malcolm,4,3,158,"Well; more anon.--Comes the king forth, I pray you?","['Well', 'anon.', 'Comes', 'king', 'forth', 'pray']"
Macbeth,Tragedy,Doctor,4,3,159,"Ay, sir; there are a crew of wretched souls","['Ay', 'sir', 'crew', 'wretched', 'souls']"
Macbeth,Tragedy,Doctor,4,3,160,That stay his cure: their malady convinces,"['stay', 'cure', 'malady', 'convinces']"
Macbeth,Tragedy,Doctor,4,3,161,The great assay of art; but at his touch--,"['great', 'assay', 'touch']"
Macbeth,Tragedy,Doctor,4,3,162,Such sanctity hath heaven given his hand--,"['sanctity', 'heaven', 'given', 'hand']"
Macbeth,Tragedy,Doctor,4,3,163,They presently amend.,"['presently', 'amend']"
Macbeth,Tragedy,Malcolm,4,3,164,"I thank you, doctor.","['thank', 'doctor']"
Macbeth,Tragedy,Macduff,4,3,165,What's the disease he means?,"['disease', 'means']"
Macbeth,Tragedy,Malcolm,4,3,166,'Tis call'd the evil:,"[""'T"", 'call', 'evil']"
Macbeth,Tragedy,Malcolm,4,3,167,A most miraculous work in this good king;,"['miraculous', 'work', 'good', 'king']"
Macbeth,Tragedy,Malcolm,4,3,168,"Which often, since my here-remain in England,","['often', 'since', 'here-remain', 'England']"
Macbeth,Tragedy,Malcolm,4,3,169,"I have seen him do. How he solicits heaven,","['seen', 'solicits', 'heaven']"
Macbeth,Tragedy,Malcolm,4,3,170,"Himself best knows: but strangely-visited people,","['best', 'knows', 'strangely-visited', 'people']"
Macbeth,Tragedy,Malcolm,4,3,171,"All swoln and ulcerous, pitiful to the eye,","['swoln', 'ulcerous', 'pitiful', 'eye']"
Macbeth,Tragedy,Malcolm,4,3,172,"The mere despair of surgery, he cures,","['mere', 'despair', 'surgery', 'cures']"
Macbeth,Tragedy,Malcolm,4,3,173,"Hanging a golden stamp about their necks,","['Hanging', 'golden', 'stamp', 'necks']"
Macbeth,Tragedy,Malcolm,4,3,174,"Put on with holy prayers: and 'tis spoken,","['Put', 'holy', 'prayers', ""'t"", 'spoken']"
Macbeth,Tragedy,Malcolm,4,3,175,To the succeeding royalty he leaves,"['succeeding', 'royalty', 'leaves']"
Macbeth,Tragedy,Malcolm,4,3,176,"The healing benediction. With this strange virtue,","['healing', 'benediction', 'strange', 'virtue']"
Macbeth,Tragedy,Malcolm,4,3,177,"He hath a heavenly gift of prophecy,","['heavenly', 'gift', 'prophecy']"
Macbeth,Tragedy,Malcolm,4,3,178,"And sundry blessings hang about his throne,","['sundry', 'blessings', 'hang', 'throne']"
Macbeth,Tragedy,Malcolm,4,3,179,That speak him full of grace.,"['speak', 'full', 'grace']"
Macbeth,Tragedy,Macduff,4,3,180,"See, who comes here?","['See', 'comes']"
Macbeth,Tragedy,Malcolm,4,3,181,My countryman; but yet I know him not.,"['countryman', 'yet', 'know']"
Macbeth,Tragedy,Macduff,4,3,182,"My ever-gentle cousin, welcome hither.","['ever-gentle', 'cousin', 'welcome', 'hither']"
Macbeth,Tragedy,Malcolm,4,3,183,"I know him now. Good God, betimes remove","['know', 'Good', 'God', 'betimes', 'remove']"
Macbeth,Tragedy,Malcolm,4,3,184,The means that makes us strangers!,"['means', 'makes', 'strangers']"
Macbeth,Tragedy,Ross,4,3,185,"Sir, amen.","['Sir', 'amen']"
Macbeth,Tragedy,Macduff,4,3,186,Stands Scotland where it did?,"['Stands', 'Scotland']"
Macbeth,Tragedy,Ross,4,3,187,"Alas, poor country!","['poor', 'country']"
Macbeth,Tragedy,Ross,4,3,188,Almost afraid to know itself. It cannot,"['Almost', 'afraid', 'know']"
Macbeth,Tragedy,Ross,4,3,189,"Be call'd our mother, but our grave; where nothing,","['call', 'mother', 'grave', 'nothing']"
Macbeth,Tragedy,Ross,4,3,190,"But who knows nothing, is once seen to smile;","['knows', 'nothing', 'seen', 'smile']"
Macbeth,Tragedy,Ross,4,3,191,Where sighs and groans and shrieks that rend the air,"['sighs', 'groans', 'shrieks', 'rend', 'air']"
Macbeth,Tragedy,Ross,4,3,192,"Are made, not mark'd; where violent sorrow seems","['made', 'mark', 'violent', 'sorrow', 'seems']"
Macbeth,Tragedy,Ross,4,3,193,A modern ecstasy; the dead man's knell,"['modern', 'ecstasy', 'dead', 'man', 'knell']"
Macbeth,Tragedy,Ross,4,3,194,Is there scarce ask'd for who; and good men's lives,"['scarce', 'ask', 'good', 'men', 'lives']"
Macbeth,Tragedy,Ross,4,3,195,"Expire before the flowers in their caps,","['Expire', 'flowers', 'caps']"
Macbeth,Tragedy,Ross,4,3,196,Dying or ere they sicken.,"['Dying', 'sicken']"
Macbeth,Tragedy,Macduff,4,3,197,"O, relation",['relation']
Macbeth,Tragedy,Macduff,4,3,198,"Too nice, and yet too true!","['nice', 'yet', 'true']"
Macbeth,Tragedy,Malcolm,4,3,199,What's the newest grief?,"['newest', 'grief']"
Macbeth,Tragedy,Ross,4,3,200,That of an hour's age doth hiss the speaker:,"['hour', 'age', 'doth', 'hiss', 'speaker']"
Macbeth,Tragedy,Ross,4,3,201,Each minute teems a new one.,"['minute', 'teems', 'new', 'one']"
Macbeth,Tragedy,Macduff,4,3,202,How does my wife?,['wife']
Macbeth,Tragedy,Ross,4,3,203,"Why, well.",['well']
Macbeth,Tragedy,Macduff,4,3,204,And all my children?,['children']
Macbeth,Tragedy,Ross,4,3,205,Well too.,['Well']
Macbeth,Tragedy,Macduff,4,3,206,The tyrant has not batter'd at their peace?,"['tyrant', 'batter', 'peace']"
Macbeth,Tragedy,Ross,4,3,207,No; they were well at peace when I did leave 'em.,"['well', 'peace', 'leave', ""'em""]"
Macbeth,Tragedy,Macduff,4,3,208,But not a niggard of your speech: how goes't?,"['niggard', 'speech', ""goes't""]"
Macbeth,Tragedy,Ross,4,3,209,"When I came hither to transport the tidings,","['came', 'hither', 'transport', 'tidings']"
Macbeth,Tragedy,Ross,4,3,210,"Which I have heavily borne, there ran a rumour","['heavily', 'borne', 'ran', 'rumour']"
Macbeth,Tragedy,Ross,4,3,211,Of many worthy fellows that were out;,"['many', 'worthy', 'fellows']"
Macbeth,Tragedy,Ross,4,3,212,"Which was to my belief witness'd the rather,","['belief', 'witness', 'rather']"
Macbeth,Tragedy,Ross,4,3,213,For that I saw the tyrant's power a-foot:,"['saw', 'tyrant', 'power', 'a-foot']"
Macbeth,Tragedy,Ross,4,3,214,Now is the time of help; your eye in Scotland,"['time', 'help', 'eye', 'Scotland']"
Macbeth,Tragedy,Ross,4,3,215,"Would create soldiers, make our women fight,","['Would', 'create', 'soldiers', 'make', 'women', 'fight']"
Macbeth,Tragedy,Ross,4,3,216,To doff their dire distresses.,"['doff', 'dire', 'distresses']"
Macbeth,Tragedy,Malcolm,4,3,217,Be't their comfort,"[""Be't"", 'comfort']"
Macbeth,Tragedy,Malcolm,4,3,218,We are coming thither: gracious England hath,"['coming', 'thither', 'gracious', 'England']"
Macbeth,Tragedy,Malcolm,4,3,219,Lent us good Siward and ten thousand men;,"['Lent', 'good', 'ten', 'thousand', 'men']"
Macbeth,Tragedy,Malcolm,4,3,220,An older and a better soldier none,"['older', 'better', 'soldier', 'none']"
Macbeth,Tragedy,Malcolm,4,3,221,That Christendom gives out.,"['Christendom', 'gives']"
Macbeth,Tragedy,Ross,4,3,222,Would I could answer,"['Would', 'could', 'answer']"
Macbeth,Tragedy,Ross,4,3,223,This comfort with the like! But I have words,"['comfort', 'like', 'words']"
Macbeth,Tragedy,Ross,4,3,224,"That would be howl'd out in the desert air,","['would', 'howl', 'desert', 'air']"
Macbeth,Tragedy,Ross,4,3,225,Where hearing should not latch them.,"['hearing', 'latch']"
Macbeth,Tragedy,Macduff,4,3,226,What concern they?,['concern']
Macbeth,Tragedy,Macduff,4,3,227,The general cause? or is it a fee-grief,"['general', 'cause', 'fee-grief']"
Macbeth,Tragedy,Macduff,4,3,228,Due to some single breast?,"['Due', 'single', 'breast']"
Macbeth,Tragedy,Ross,4,3,229,No mind that's honest,"['mind', 'honest']"
Macbeth,Tragedy,Ross,4,3,230,But in it shares some woe; though the main part,"['shares', 'woe', 'though', 'main', 'part']"
Macbeth,Tragedy,Ross,4,3,231,Pertains to you alone.,"['Pertains', 'alone']"
Macbeth,Tragedy,Macduff,4,3,232,"If it be mine,",[]
Macbeth,Tragedy,Macduff,4,3,233,"Keep it not from me, quickly let me have it.","['Keep', 'quickly', 'let']"
Macbeth,Tragedy,Ross,4,3,234,"Let not your ears despise my tongue for ever,","['Let', 'ears', 'despise', 'tongue', 'ever']"
Macbeth,Tragedy,Ross,4,3,235,Which shall possess them with the heaviest sound,"['shall', 'possess', 'heaviest', 'sound']"
Macbeth,Tragedy,Ross,4,3,236,That ever yet they heard.,"['ever', 'yet', 'heard']"
Macbeth,Tragedy,Macduff,4,3,237,Hum! I guess at it.,"['Hum', 'guess']"
Macbeth,Tragedy,Ross,4,3,238,Your castle is surprised; your wife and babes,"['castle', 'surprised', 'wife', 'babes']"
Macbeth,Tragedy,Ross,4,3,239,"Savagely slaughter'd: to relate the manner,","['Savagely', 'slaughter', 'relate', 'manner']"
Macbeth,Tragedy,Ross,4,3,240,"Were, on the quarry of these murder'd deer,","['quarry', 'murder', 'deer']"
Macbeth,Tragedy,Ross,4,3,241,To add the death of you.,"['add', 'death']"
Macbeth,Tragedy,Malcolm,4,3,242,Merciful heaven!,"['Merciful', 'heaven']"
Macbeth,Tragedy,Malcolm,4,3,243,"What, man! ne'er pull your hat upon your brows;","['man', ""ne'er"", 'pull', 'hat', 'upon', 'brows']"
Macbeth,Tragedy,Malcolm,4,3,244,Give sorrow words: the grief that does not speak,"['Give', 'sorrow', 'words', 'grief', 'speak']"
Macbeth,Tragedy,Malcolm,4,3,245,Whispers the o'er-fraught heart and bids it break.,"['Whispers', ""o'er-fraught"", 'heart', 'bids', 'break']"
Macbeth,Tragedy,Macduff,4,3,246,My children too?,['children']
Macbeth,Tragedy,Ross,4,3,247,"Wife, children, servants, all","['Wife', 'children', 'servants']"
Macbeth,Tragedy,Ross,4,3,248,That could be found.,"['could', 'found']"
Macbeth,Tragedy,Macduff,4,3,249,And I must be from thence!,"['must', 'thence']"
Macbeth,Tragedy,Macduff,4,3,250,My wife kill'd too?,"['wife', 'kill']"
Macbeth,Tragedy,Ross,4,3,251,I have said.,['said']
Macbeth,Tragedy,Malcolm,4,3,252,Be comforted:,['comforted']
Macbeth,Tragedy,Malcolm,4,3,253,"Let's make us medicines of our great revenge,","['Let', 'make', 'medicines', 'great', 'revenge']"
Macbeth,Tragedy,Malcolm,4,3,254,To cure this deadly grief.,"['cure', 'deadly', 'grief']"
Macbeth,Tragedy,Macduff,4,3,255,He has no children. All my pretty ones?,"['children', 'pretty', 'ones']"
Macbeth,Tragedy,Macduff,4,3,256,Did you say all? O hell-kite! All?,"['say', 'hell-kite']"
Macbeth,Tragedy,Macduff,4,3,257,"What, all my pretty chickens and their dam","['pretty', 'chickens', 'dam']"
Macbeth,Tragedy,Macduff,4,3,258,At one fell swoop?,"['one', 'fell', 'swoop']"
Macbeth,Tragedy,Malcolm,4,3,259,Dispute it like a man.,"['Dispute', 'like', 'man']"
Macbeth,Tragedy,Macduff,4,3,260,I shall do so;,['shall']
Macbeth,Tragedy,Macduff,4,3,261,But I must also feel it as a man:,"['must', 'also', 'feel', 'man']"
Macbeth,Tragedy,Macduff,4,3,262,"I cannot but remember such things were,","['remember', 'things']"
Macbeth,Tragedy,Macduff,4,3,263,"That were most precious to me. Did heaven look on,","['precious', 'heaven', 'look']"
Macbeth,Tragedy,Macduff,4,3,264,"And would not take their part? Sinful Macduff,","['would', 'take', 'part', 'Sinful']"
Macbeth,Tragedy,Macduff,4,3,265,"They were all struck for thee! naught that I am,","['struck', 'naught']"
Macbeth,Tragedy,Macduff,4,3,266,"Not for their own demerits, but for mine,",['demerits']
Macbeth,Tragedy,Macduff,4,3,267,Fell slaughter on their souls. Heaven rest them now!,"['Fell', 'slaughter', 'souls', 'Heaven', 'rest']"
Macbeth,Tragedy,Malcolm,4,3,268,Be this the whetstone of your sword: let grief,"['whetstone', 'sword', 'let', 'grief']"
Macbeth,Tragedy,Malcolm,4,3,269,"Convert to anger; blunt not the heart, enrage it.","['Convert', 'anger', 'blunt', 'heart', 'enrage']"
Macbeth,Tragedy,Macduff,4,3,270,"O, I could play the woman with mine eyes","['could', 'play', 'woman', 'eyes']"
Macbeth,Tragedy,Macduff,4,3,271,"And braggart with my tongue! But, gentle heavens,","['braggart', 'tongue', 'gentle', 'heavens']"
Macbeth,Tragedy,Macduff,4,3,272,Cut short all intermission; front to front,"['Cut', 'short', 'intermission', 'front', 'front']"
Macbeth,Tragedy,Macduff,4,3,273,Bring thou this fiend of Scotland and myself;,"['Bring', 'fiend', 'Scotland']"
Macbeth,Tragedy,Macduff,4,3,274,"Within my sword's length set him; if he 'scape,","['Within', 'sword', 'length', 'set', ""'scape""]"
Macbeth,Tragedy,Macduff,4,3,275,Heaven forgive him too!,"['Heaven', 'forgive']"
Macbeth,Tragedy,Malcolm,4,3,276,This tune goes manly.,"['tune', 'goes', 'manly']"
Macbeth,Tragedy,Malcolm,4,3,277,"Come, go we to the king; our power is ready;","['Come', 'go', 'king', 'power', 'ready']"
Macbeth,Tragedy,Malcolm,4,3,278,Our lack is nothing but our leave; Macbeth,"['lack', 'nothing', 'leave']"
Macbeth,Tragedy,Malcolm,4,3,279,"Is ripe for shaking, and the powers above","['ripe', 'shaking', 'powers']"
Macbeth,Tragedy,Malcolm,4,3,280,Put on their instruments. Receive what cheer you may:,"['Put', 'instruments', 'Receive', 'cheer', 'may']"
Macbeth,Tragedy,Malcolm,4,3,281,The night is long that never finds the day.,"['night', 'long', 'never', 'finds', 'day']"
Macbeth,Tragedy,Doctor,5,1,1,"I have two nights watched with you, but can perceive","['two', 'nights', 'watched', 'perceive']"
Macbeth,Tragedy,Doctor,5,1,2,no truth in your report. When was it she last walked?,"['truth', 'report', 'last', 'walked']"
Macbeth,Tragedy,Gentlewoman,5,1,3,"Since his majesty went into the field, I have seen","['Since', 'majesty', 'went', 'field', 'seen']"
Macbeth,Tragedy,Gentlewoman,5,1,4,"her rise from her bed, throw her night-gown upon","['rise', 'bed', 'throw', 'night-gown', 'upon']"
Macbeth,Tragedy,Gentlewoman,5,1,5,"her, unlock her closet, take forth paper, fold it,","['unlock', 'closet', 'take', 'forth', 'paper', 'fold']"
Macbeth,Tragedy,Gentlewoman,5,1,6,"write upon't, read it, afterwards seal it, and again","['write', 'upo', ""n't"", 'read', 'afterwards', 'seal']"
Macbeth,Tragedy,Gentlewoman,5,1,7,return to bed; yet all this while in a most fast sleep.,"['return', 'bed', 'yet', 'fast', 'sleep']"
Macbeth,Tragedy,Doctor,5,1,8,"A great perturbation in nature, to receive at once","['great', 'perturbation', 'nature', 'receive']"
Macbeth,Tragedy,Doctor,5,1,9,"the benefit of sleep, and do the effects of","['benefit', 'sleep', 'effects']"
