play_name,genre,character,act,scene,sentence,text,tokens
Macbeth,Tragedy,Lady Macbeth,1,7,52,"What beast was't, then,","['beast', ""was't""]"
Macbeth,Tragedy,Lady Macbeth,1,7,53,That made you break this enterprise to me?,"['made', 'break', 'enterprise']"
Macbeth,Tragedy,Lady Macbeth,1,7,54,"When you durst do it, then you were a man;","['durst', 'man']"
Macbeth,Tragedy,Lady Macbeth,1,7,55,"And, to be more than what you were, you would",['would']
Macbeth,Tragedy,Lady Macbeth,1,7,56,Be so much more the man. Nor time nor place,"['much', 'man', 'time', 'place']"
Macbeth,Tragedy,Lady Macbeth,1,7,57,"Did then adhere, and yet you would make both:","['adhere', 'yet', 'would', 'make']"
Macbeth,Tragedy,Lady Macbeth,1,7,58,"They have made themselves, and that their fitness now","['made', 'fitness']"
Macbeth,Tragedy,Lady Macbeth,1,7,59,"Does unmake you. I have given suck, and know","['unmake', 'given', 'suck', 'know']"
Macbeth,Tragedy,Lady Macbeth,1,7,60,How tender 'tis to love the babe that milks me:,"['tender', ""'t"", 'love', 'babe', 'milks']"
Macbeth,Tragedy,Lady Macbeth,1,7,61,"I would, while it was smiling in my face,","['would', 'smiling', 'face']"
Macbeth,Tragedy,Lady Macbeth,1,7,62,"Have pluck'd my nipple from his boneless gums,","['pluck', 'nipple', 'boneless', 'gums']"
Macbeth,Tragedy,Lady Macbeth,1,7,63,"And dash'd the brains out, had I so sworn as you","['dash', 'brains', 'sworn']"
Macbeth,Tragedy,Lady Macbeth,1,7,64,Have done to this.,['done']
Macbeth,Tragedy,Macbeth,1,7,65,If we should fail?,['fail']
Macbeth,Tragedy,Lady Macbeth,1,7,66,We fail!,['fail']
Macbeth,Tragedy,Lady Macbeth,1,7,67,"But screw your courage to the sticking-place,","['screw', 'courage', 'sticking-place']"
Macbeth,Tragedy,Lady Macbeth,1,7,68,And we'll not fail. When Duncan is asleep--,"['fail', 'asleep']"
Macbeth,Tragedy,Lady Macbeth,1,7,69,Whereto the rather shall his day's hard journey,"['Whereto', 'rather', 'shall', 'day', 'hard', 'journey']"
Macbeth,Tragedy,Lady Macbeth,1,7,70,Soundly invite him--his two chamberlains,"['Soundly', 'invite', 'two', 'chamberlains']"
Macbeth,Tragedy,Lady Macbeth,1,7,71,Will I with wine and wassail so convince,"['wine', 'wassail', 'convince']"
Macbeth,Tragedy,Lady Macbeth,1,7,72,"That memory, the warder of the brain,","['memory', 'warder', 'brain']"
Macbeth,Tragedy,Lady Macbeth,1,7,73,"Shall be a fume, and the receipt of reason","['Shall', 'fume', 'receipt', 'reason']"
Macbeth,Tragedy,Lady Macbeth,1,7,74,A limbeck only: when in swinish sleep,"['limbeck', 'swinish', 'sleep']"
Macbeth,Tragedy,Lady Macbeth,1,7,75,"Their drenched natures lie as in a death,","['drenched', 'natures', 'lie', 'death']"
Macbeth,Tragedy,Lady Macbeth,1,7,76,What cannot you and I perform upon,"['perform', 'upon']"
Macbeth,Tragedy,Lady Macbeth,1,7,77,The unguarded Duncan? what not put upon,"['unguarded', 'put', 'upon']"
Macbeth,Tragedy,Lady Macbeth,1,7,78,"His spongy officers, who shall bear the guilt","['spongy', 'officers', 'shall', 'bear', 'guilt']"
Macbeth,Tragedy,Lady Macbeth,1,7,79,Of our great quell?,"['great', 'quell']"
Macbeth,Tragedy,Macbeth,1,7,80,Bring forth men-children only;,"['Bring', 'forth', 'men-children']"
Macbeth,Tragedy,Macbeth,1,7,81,For thy undaunted mettle should compose,"['undaunted', 'mettle', 'compose']"
Macbeth,Tragedy,Macbeth,1,7,82,"Nothing but males. Will it not be received,","['Nothing', 'males', 'received']"
Macbeth,Tragedy,Macbeth,1,7,83,When we have mark'd with blood those sleepy two,"['mark', 'blood', 'sleepy', 'two']"
Macbeth,Tragedy,Macbeth,1,7,84,"Of his own chamber and used their very daggers,","['chamber', 'used', 'daggers']"
Macbeth,Tragedy,Macbeth,1,7,85,That they have done't?,"[""done't""]"
Macbeth,Tragedy,Lady Macbeth,1,7,86,"Who dares receive it other,","['dares', 'receive']"
Macbeth,Tragedy,Lady Macbeth,1,7,87,As we shall make our griefs and clamour roar,"['shall', 'make', 'griefs', 'clamour', 'roar']"
Macbeth,Tragedy,Lady Macbeth,1,7,88,Upon his death?,"['Upon', 'death']"
Macbeth,Tragedy,Macbeth,1,7,89,"I am settled, and bend up","['settled', 'bend']"
Macbeth,Tragedy,Macbeth,1,7,90,Each corporal agent to this terrible feat.,"['corporal', 'agent', 'terrible', 'feat']"
Macbeth,Tragedy,Macbeth,1,7,91,"Away, and mock the time with fairest show:","['Away', 'mock', 'time', 'fairest', 'show']"
Macbeth,Tragedy,Macbeth,1,7,92,False face must hide what the false heart doth know.,"['False', 'face', 'must', 'hide', 'false', 'heart', 'doth', 'know']"
Macbeth,Tragedy,Banquo,2,1,1,"How goes the night, boy?","['goes', 'night', 'boy']"
Macbeth,Tragedy,Fleance,2,1,2,The moon is down; I have not heard the clock.,"['moon', 'heard', 'clock']"
Macbeth,Tragedy,Banquo,2,1,3,And she goes down at twelve.,"['goes', 'twelve']"
Macbeth,Tragedy,Fleance,2,1,4,"I take't, 'tis later, sir.","[""take't"", ""'t"", 'later', 'sir']"
Macbeth,Tragedy,Banquo,2,1,5,"Hold, take my sword. There's husbandry in heaven;","['Hold', 'take', 'sword', 'husbandry', 'heaven']"
Macbeth,Tragedy,Banquo,2,1,6,Their candles are all out. Take thee that too.,"['candles', 'Take']"
Macbeth,Tragedy,Banquo,2,1,7,"A heavy summons lies like lead upon me,","['heavy', 'summons', 'lies', 'like', 'lead', 'upon']"
Macbeth,Tragedy,Banquo,2,1,8,"And yet I would not sleep: merciful powers,","['yet', 'would', 'sleep', 'merciful', 'powers']"
Macbeth,Tragedy,Banquo,2,1,9,Restrain in me the cursed thoughts that nature,"['Restrain', 'cursed', 'thoughts', 'nature']"
Macbeth,Tragedy,Banquo,2,1,10,Gives way to in repose!,"['Gives', 'way', 'repose']"
Macbeth,Tragedy,Banquo,2,1,11,Give me my sword.,"['Give', 'sword']"
Macbeth,Tragedy,Banquo,2,1,12,Who's there?,[]
Macbeth,Tragedy,Macbeth,2,1,13,A friend.,['friend']
Macbeth,Tragedy,Banquo,2,1,14,"What, sir, not yet at rest? The king's a-bed:","['sir', 'yet', 'rest', 'king', 'a-bed']"
Macbeth,Tragedy,Banquo,2,1,15,"He hath been in unusual pleasure, and","['unusual', 'pleasure']"
Macbeth,Tragedy,Banquo,2,1,16,Sent forth great largess to your offices.,"['Sent', 'forth', 'great', 'largess', 'offices']"
Macbeth,Tragedy,Banquo,2,1,17,"This diamond he greets your wife withal,","['diamond', 'greets', 'wife', 'withal']"
Macbeth,Tragedy,Banquo,2,1,18,By the name of most kind hostess; and shut up,"['name', 'kind', 'hostess', 'shut']"
Macbeth,Tragedy,Banquo,2,1,19,In measureless content.,"['measureless', 'content']"
Macbeth,Tragedy,Macbeth,2,1,20,"Being unprepared,",['unprepared']
Macbeth,Tragedy,Macbeth,2,1,21,Our will became the servant to defect;,"['became', 'servant', 'defect']"
Macbeth,Tragedy,Macbeth,2,1,22,Which else should free have wrought.,"['else', 'free', 'wrought']"
Macbeth,Tragedy,Banquo,2,1,23,All's well.,['well']
Macbeth,Tragedy,Banquo,2,1,24,I dreamt last night of the three weird sisters:,"['dreamt', 'last', 'night', 'three', 'weird', 'sisters']"
Macbeth,Tragedy,Banquo,2,1,25,To you they have show'd some truth.,"['show', 'truth']"
Macbeth,Tragedy,Macbeth,2,1,26,I think not of them:,['think']
Macbeth,Tragedy,Macbeth,2,1,27,"Yet, when we can entreat an hour to serve,","['Yet', 'entreat', 'hour', 'serve']"
Macbeth,Tragedy,Macbeth,2,1,28,"We would spend it in some words upon that business,","['would', 'spend', 'words', 'upon', 'business']"
Macbeth,Tragedy,Macbeth,2,1,29,If you would grant the time.,"['would', 'grant', 'time']"
Macbeth,Tragedy,Banquo,2,1,30,At your kind'st leisure.,"[""kind'st"", 'leisure']"
Macbeth,Tragedy,Macbeth,2,1,31,"If you shall cleave to my consent, when 'tis,","['shall', 'cleave', 'consent', ""'t""]"
Macbeth,Tragedy,Macbeth,2,1,32,It shall make honour for you.,"['shall', 'make', 'honour']"
Macbeth,Tragedy,Banquo,2,1,33,So I lose none,"['lose', 'none']"
Macbeth,Tragedy,Banquo,2,1,34,"In seeking to augment it, but still keep","['seeking', 'augment', 'still', 'keep']"
Macbeth,Tragedy,Banquo,2,1,35,"My bosom franchised and allegiance clear,","['bosom', 'franchised', 'allegiance', 'clear']"
Macbeth,Tragedy,Banquo,2,1,36,I shall be counsell'd.,"['shall', 'counsell']"
Macbeth,Tragedy,Macbeth,2,1,37,Good repose the while!,"['Good', 'repose']"
Macbeth,Tragedy,Banquo,2,1,38,"Thanks, sir: the like to you!","['Thanks', 'sir', 'like']"
Macbeth,Tragedy,Macbeth,2,1,39,"Go bid thy mistress, when my drink is ready,","['Go', 'bid', 'mistress', 'drink', 'ready']"
Macbeth,Tragedy,Macbeth,2,1,40,She strike upon the bell. Get thee to bed.,"['strike', 'upon', 'bell', 'Get', 'bed']"
Macbeth,Tragedy,Macbeth,2,1,41,"Is this a dagger which I see before me,","['dagger', 'see']"
Macbeth,Tragedy,Macbeth,2,1,42,"The handle toward my hand? Come, let me clutch thee.","['handle', 'toward', 'hand', 'Come', 'let', 'clutch']"
Macbeth,Tragedy,Macbeth,2,1,43,"I have thee not, and yet I see thee still.","['yet', 'see', 'still']"
Macbeth,Tragedy,Macbeth,2,1,44,"Art thou not, fatal vision, sensible","['fatal', 'vision', 'sensible']"
Macbeth,Tragedy,Macbeth,2,1,45,To feeling as to sight? or art thou but,"['feeling', 'sight']"
Macbeth,Tragedy,Macbeth,2,1,46,"A dagger of the mind, a false creation,","['dagger', 'mind', 'false', 'creation']"
Macbeth,Tragedy,Macbeth,2,1,47,Proceeding from the heat-oppressed brain?,"['Proceeding', 'heat-oppressed', 'brain']"
Macbeth,Tragedy,Macbeth,2,1,48,"I see thee yet, in form as palpable","['see', 'yet', 'form', 'palpable']"
Macbeth,Tragedy,Macbeth,2,1,49,As this which now I draw.,['draw']
Macbeth,Tragedy,Macbeth,2,1,50,Thou marshall'st me the way that I was going;,"[""marshall'st"", 'way', 'going']"
Macbeth,Tragedy,Macbeth,2,1,51,And such an instrument I was to use.,"['instrument', 'use']"
Macbeth,Tragedy,Macbeth,2,1,52,"Mine eyes are made the fools o' the other senses,","['eyes', 'made', 'fools', 'senses']"
Macbeth,Tragedy,Macbeth,2,1,53,"Or else worth all the rest; I see thee still,","['else', 'worth', 'rest', 'see', 'still']"
Macbeth,Tragedy,Macbeth,2,1,54,"And on thy blade and dudgeon gouts of blood,","['blade', 'dudgeon', 'gouts', 'blood']"
Macbeth,Tragedy,Macbeth,2,1,55,Which was not so before. There's no such thing:,['thing']
Macbeth,Tragedy,Macbeth,2,1,56,It is the bloody business which informs,"['bloody', 'business', 'informs']"
Macbeth,Tragedy,Macbeth,2,1,57,Thus to mine eyes. Now o'er the one halfworld,"['Thus', 'eyes', ""o'er"", 'one', 'halfworld']"
Macbeth,Tragedy,Macbeth,2,1,58,"Nature seems dead, and wicked dreams abuse","['Nature', 'seems', 'dead', 'wicked', 'dreams', 'abuse']"
Macbeth,Tragedy,Macbeth,2,1,59,The curtain'd sleep; witchcraft celebrates,"['curtain', 'sleep', 'witchcraft', 'celebrates']"
Macbeth,Tragedy,Macbeth,2,1,60,"Pale Hecate's offerings, and wither'd murder,","['Pale', 'offerings', 'wither', 'murder']"
Macbeth,Tragedy,Macbeth,2,1,61,"Alarum'd by his sentinel, the wolf,","['Alarum', 'sentinel', 'wolf']"
Macbeth,Tragedy,Macbeth,2,1,62,"Whose howl's his watch, thus with his stealthy pace.","['Whose', 'howl', 'watch', 'thus', 'stealthy', 'pace']"
Macbeth,Tragedy,Macbeth,2,1,63,"With Tarquin's ravishing strides, towards his design","['Tarquin', 'ravishing', 'strides', 'towards', 'design']"
Macbeth,Tragedy,Macbeth,2,1,64,"Moves like a ghost. Thou sure and firm-set earth,","['Moves', 'like', 'ghost', 'sure', 'firm-set', 'earth']"
Macbeth,Tragedy,Macbeth,2,1,65,"Hear not my steps, which way they walk, for fear","['Hear', 'steps', 'way', 'walk', 'fear']"
Macbeth,Tragedy,Macbeth,2,1,66,"Thy very stones prate of my whereabout,","['stones', 'prate', 'whereabout']"
Macbeth,Tragedy,Macbeth,2,1,67,"And take the present horror from the time,","['take', 'present', 'horror', 'time']"
Macbeth,Tragedy,Macbeth,2,1,68,"Which now suits with it. Whiles I threat, he lives:","['suits', 'Whiles', 'threat', 'lives']"
Macbeth,Tragedy,Macbeth,2,1,69,Words to the heat of deeds too cold breath gives.,"['Words', 'heat', 'deeds', 'cold', 'breath', 'gives']"
Macbeth,Tragedy,Macbeth,2,1,70,"I go, and it is done; the bell invites me.","['go', 'done', 'bell', 'invites']"
Macbeth,Tragedy,Macbeth,2,1,71,"Hear it not, Duncan; for it is a knell","['Hear', 'knell']"
Macbeth,Tragedy,Macbeth,2,1,72,That summons thee to heaven or to hell.,"['summons', 'heaven', 'hell']"
Macbeth,Tragedy,Lady Macbeth,2,2,1,That which hath made them drunk hath made me bold;,"['made', 'drunk', 'made', 'bold']"
Macbeth,Tragedy,Lady Macbeth,2,2,2,What hath quench'd them hath given me fire.,"['quench', 'given', 'fire']"
Macbeth,Tragedy,Lady Macbeth,2,2,3,Hark! Peace!,"['Hark', 'Peace']"
Macbeth,Tragedy,Lady Macbeth,2,2,4,"It was the owl that shriek'd, the fatal bellman,","['owl', 'shriek', 'fatal', 'bellman']"
Macbeth,Tragedy,Lady Macbeth,2,2,5,Which gives the stern'st good-night. He is about it:,"['gives', ""stern'st"", 'good-night']"
Macbeth,Tragedy,Lady Macbeth,2,2,6,The doors are open; and the surfeited grooms,"['doors', 'open', 'surfeited', 'grooms']"
Macbeth,Tragedy,Lady Macbeth,2,2,7,Do mock their charge with snores: I have drugg'd,"['mock', 'charge', 'snores', 'drugg']"
Macbeth,Tragedy,Lady Macbeth,2,2,8,"their possets,",['possets']
Macbeth,Tragedy,Lady Macbeth,2,2,9,"That death and nature do contend about them,","['death', 'nature', 'contend']"
Macbeth,Tragedy,Lady Macbeth,2,2,10,Whether they live or die.,"['Whether', 'live', 'die']"
Macbeth,Tragedy,Macbeth,2,2,11,"[Within]  Who's there? what, ho!","['Within', 'ho']"
Macbeth,Tragedy,Lady Macbeth,2,2,12,"Alack, I am afraid they have awaked,","['Alack', 'afraid', 'awaked']"
Macbeth,Tragedy,Lady Macbeth,2,2,13,And 'tis not done. The attempt and not the deed,"[""'t"", 'done', 'attempt', 'deed']"
Macbeth,Tragedy,Lady Macbeth,2,2,14,Confounds us. Hark! I laid their daggers ready;,"['Confounds', 'Hark', 'laid', 'daggers', 'ready']"
Macbeth,Tragedy,Lady Macbeth,2,2,15,He could not miss 'em. Had he not resembled,"['could', 'miss', ""'em"", 'resembled']"
Macbeth,Tragedy,Lady Macbeth,2,2,16,"My father as he slept, I had done't.","['father', 'slept', ""done't""]"
Macbeth,Tragedy,Lady Macbeth,2,2,17,My husband!,['husband']
Macbeth,Tragedy,Macbeth,2,2,18,I have done the deed. Didst thou not hear a noise?,"['done', 'deed', 'Didst', 'hear', 'noise']"
Macbeth,Tragedy,Lady Macbeth,2,2,19,I heard the owl scream and the crickets cry.,"['heard', 'owl', 'scream', 'crickets', 'cry']"
Macbeth,Tragedy,Lady Macbeth,2,2,20,Did not you speak?,['speak']
Macbeth,Tragedy,Macbeth,2,2,21,When?,[]
Macbeth,Tragedy,Lady Macbeth,2,2,22,Now.,[]
Macbeth,Tragedy,Macbeth,2,2,23,As I descended?,['descended']
Macbeth,Tragedy,Lady Macbeth,2,2,24,Ay.,['Ay']
Macbeth,Tragedy,Macbeth,2,2,25,Hark!,['Hark']
Macbeth,Tragedy,Macbeth,2,2,26,Who lies i' the second chamber?,"['lies', 'second', 'chamber']"
Macbeth,Tragedy,Lady Macbeth,2,2,27,Donalbain.,[]
Macbeth,Tragedy,Macbeth,2,2,28,This is a sorry sight.,"['sorry', 'sight']"
Macbeth,Tragedy,Lady Macbeth,2,2,29,"A foolish thought, to say a sorry sight.","['foolish', 'thought', 'say', 'sorry', 'sight']"
Macbeth,Tragedy,Macbeth,2,2,30,"There's one did laugh in's sleep, and one cried","['one', 'laugh', 'sleep', 'one', 'cried']"
Macbeth,Tragedy,Macbeth,2,2,31,'Murder!',"[""'Murder""]"
Macbeth,Tragedy,Macbeth,2,2,32,That they did wake each other: I stood and heard them:,"['wake', 'stood', 'heard']"
Macbeth,Tragedy,Macbeth,2,2,33,"But they did say their prayers, and address'd them","['say', 'prayers', 'address']"
Macbeth,Tragedy,Macbeth,2,2,34,Again to sleep.,['sleep']
Macbeth,Tragedy,Lady Macbeth,2,2,35,There are two lodged together.,"['two', 'lodged', 'together']"
Macbeth,Tragedy,Macbeth,2,2,36,One cried 'God bless us!' and 'Amen' the other;,"['One', 'cried', ""'God"", 'bless', ""'Amen""]"
Macbeth,Tragedy,Macbeth,2,2,37,As they had seen me with these hangman's hands.,"['seen', 'hangman', 'hands']"
Macbeth,Tragedy,Macbeth,2,2,38,"Listening their fear, I could not say 'Amen,'","['Listening', 'fear', 'could', 'say', ""'Amen""]"
Macbeth,Tragedy,Macbeth,2,2,39,When they did say 'God bless us!',"['say', ""'God"", 'bless']"
Macbeth,Tragedy,Lady Macbeth,2,2,40,Consider it not so deeply.,"['Consider', 'deeply']"
Macbeth,Tragedy,Macbeth,2,2,41,But wherefore could not I pronounce 'Amen'?,"['could', 'pronounce', ""'Amen""]"
Macbeth,Tragedy,Macbeth,2,2,42,"I had most need of blessing, and 'Amen'","['need', 'blessing', ""'Amen""]"
Macbeth,Tragedy,Macbeth,2,2,43,Stuck in my throat.,"['Stuck', 'throat']"
Macbeth,Tragedy,Lady Macbeth,2,2,44,These deeds must not be thought,"['deeds', 'must', 'thought']"
Macbeth,Tragedy,Lady Macbeth,2,2,45,"After these ways; so, it will make us mad.","['ways', 'make', 'mad']"
Macbeth,Tragedy,Macbeth,2,2,46,Methought I heard a voice cry 'Sleep no more!,"['Methought', 'heard', 'voice', 'cry', ""'Sleep""]"
Macbeth,Tragedy,Macbeth,2,2,47,"Macbeth does murder sleep', the innocent sleep,","['murder', 'sleep', 'innocent', 'sleep']"
Macbeth,Tragedy,Macbeth,2,2,48,"Sleep that knits up the ravell'd sleeve of care,","['Sleep', 'knits', 'ravell', 'sleeve', 'care']"
Macbeth,Tragedy,Macbeth,2,2,49,"The death of each day's life, sore labour's bath,","['death', 'day', 'life', 'sore', 'labour', 'bath']"
Macbeth,Tragedy,Macbeth,2,2,50,"Balm of hurt minds, great nature's second course,","['Balm', 'hurt', 'minds', 'great', 'nature', 'second', 'course']"
Macbeth,Tragedy,Macbeth,2,2,51,"Chief nourisher in life's feast,--","['Chief', 'nourisher', 'life', 'feast']"
Macbeth,Tragedy,Lady Macbeth,2,2,52,What do you mean?,['mean']
Macbeth,Tragedy,Macbeth,2,2,53,Still it cried 'Sleep no more!' to all the house:,"['Still', 'cried', ""'Sleep"", 'house']"
Macbeth,Tragedy,Macbeth,2,2,54,"'Glamis hath murder'd sleep, and therefore Cawdor","[""'Glamis"", 'murder', 'sleep', 'therefore', 'Cawdor']"
Macbeth,Tragedy,Macbeth,2,2,55,Shall sleep no more; Macbeth shall sleep no more.',"['Shall', 'sleep', 'shall', 'sleep']"
Macbeth,Tragedy,Lady Macbeth,2,2,56,"Who was it that thus cried? Why, worthy thane,","['thus', 'cried', 'worthy', 'thane']"
Macbeth,Tragedy,Lady Macbeth,2,2,57,"You do unbend your noble strength, to think","['unbend', 'noble', 'strength', 'think']"
Macbeth,Tragedy,Lady Macbeth,2,2,58,"So brainsickly of things. Go get some water,","['brainsickly', 'things', 'Go', 'get', 'water']"
Macbeth,Tragedy,Lady Macbeth,2,2,59,And wash this filthy witness from your hand.,"['wash', 'filthy', 'witness', 'hand']"
Macbeth,Tragedy,Lady Macbeth,2,2,60,Why did you bring these daggers from the place?,"['bring', 'daggers', 'place']"
Macbeth,Tragedy,Lady Macbeth,2,2,61,They must lie there: go carry them; and smear,"['must', 'lie', 'go', 'carry', 'smear']"
Macbeth,Tragedy,Lady Macbeth,2,2,62,The sleepy grooms with blood.,"['sleepy', 'grooms', 'blood']"
Macbeth,Tragedy,Macbeth,2,2,63,I'll go no more:,['go']
Macbeth,Tragedy,Macbeth,2,2,64,I am afraid to think what I have done;,"['afraid', 'think', 'done']"
Macbeth,Tragedy,Macbeth,2,2,65,Look on't again I dare not.,"['Look', ""n't"", 'dare']"
Macbeth,Tragedy,Lady Macbeth,2,2,66,Infirm of purpose!,"['Infirm', 'purpose']"
Macbeth,Tragedy,Lady Macbeth,2,2,67,Give me the daggers: the sleeping and the dead,"['Give', 'daggers', 'sleeping', 'dead']"
Macbeth,Tragedy,Lady Macbeth,2,2,68,Are but as pictures: 'tis the eye of childhood,"['pictures', ""'t"", 'eye', 'childhood']"
Macbeth,Tragedy,Lady Macbeth,2,2,69,"That fears a painted devil. If he do bleed,","['fears', 'painted', 'devil', 'bleed']"
Macbeth,Tragedy,Lady Macbeth,2,2,70,I'll gild the faces of the grooms withal;,"['gild', 'faces', 'grooms', 'withal']"
Macbeth,Tragedy,Lady Macbeth,2,2,71,For it must seem their guilt.,"['must', 'seem', 'guilt']"
Macbeth,Tragedy,Macbeth,2,2,72,Whence is that knocking?,['knocking']
Macbeth,Tragedy,Macbeth,2,2,73,"How is't with me, when every noise appals me?","[""is't"", 'every', 'noise', 'appals']"
Macbeth,Tragedy,Macbeth,2,2,74,What hands are here? ha! they pluck out mine eyes.,"['hands', 'ha', 'pluck', 'eyes']"
Macbeth,Tragedy,Macbeth,2,2,75,Will all great Neptune's ocean wash this blood,"['great', 'Neptune', 'ocean', 'wash', 'blood']"
Macbeth,Tragedy,Macbeth,2,2,76,"Clean from my hand? No, this my hand will rather","['Clean', 'hand', 'hand', 'rather']"
Macbeth,Tragedy,Macbeth,2,2,77,"The multitudinous seas in incarnadine,","['multitudinous', 'seas', 'incarnadine']"
Macbeth,Tragedy,Macbeth,2,2,78,Making the green one red.,"['Making', 'green', 'one', 'red']"
Macbeth,Tragedy,Lady Macbeth,2,2,79,My hands are of your colour; but I shame,"['hands', 'colour', 'shame']"
Macbeth,Tragedy,Lady Macbeth,2,2,80,To wear a heart so white.,"['wear', 'heart', 'white']"
Macbeth,Tragedy,Lady Macbeth,2,2,81,I hear a knocking,"['hear', 'knocking']"
Macbeth,Tragedy,Lady Macbeth,2,2,82,At the south entry: retire we to our chamber;,"['south', 'entry', 'retire', 'chamber']"
Macbeth,Tragedy,Lady Macbeth,2,2,83,A little water clears us of this deed:,"['little', 'water', 'clears', 'deed']"
Macbeth,Tragedy,Lady Macbeth,2,2,84,"How easy is it, then! Your constancy","['easy', 'constancy']"
Macbeth,Tragedy,Lady Macbeth,2,2,85,Hath left you unattended.,"['left', 'unattended']"
Macbeth,Tragedy,Lady Macbeth,2,2,86,Hark! more knocking.,"['Hark', 'knocking']"
Macbeth,Tragedy,Lady Macbeth,2,2,87,"Get on your nightgown, lest occasion call us,","['Get', 'nightgown', 'lest', 'occasion', 'call']"
Macbeth,Tragedy,Lady Macbeth,2,2,88,And show us to be watchers. Be not lost,"['show', 'watchers', 'lost']"
Macbeth,Tragedy,Lady Macbeth,2,2,89,So poorly in your thoughts.,"['poorly', 'thoughts']"
Macbeth,Tragedy,Macbeth,2,2,90,"To know my deed, 'twere best not know myself.","['know', 'deed', ""'twere"", 'best', 'know']"
Macbeth,Tragedy,Macbeth,2,2,91,Wake Duncan with thy knocking! I would thou couldst!,"['Wake', 'knocking', 'would']"
Macbeth,Tragedy,Porter,2,3,1,Here's a knocking indeed! If a,"['knocking', 'indeed']"
Macbeth,Tragedy,Porter,2,3,2,"man were porter of hell-gate, he should have","['man', 'porter', 'hell-gate']"
Macbeth,Tragedy,Porter,2,3,3,old turning the key.,"['old', 'turning', 'key']"
Macbeth,Tragedy,Porter,2,3,4,"Knock,",['Knock']
Macbeth,Tragedy,Porter,2,3,5,"knock, knock! Who's there, i' the name of","['knock', 'knock', 'name']"
Macbeth,Tragedy,Porter,2,3,6,"Beelzebub? Here's a farmer, that hanged","['Beelzebub', 'farmer', 'hanged']"
Macbeth,Tragedy,Porter,2,3,7,himself on the expectation of plenty: come in,"['expectation', 'plenty', 'come']"
Macbeth,Tragedy,Porter,2,3,8,time; have napkins enow about you; here,"['time', 'napkins', 'enow']"
Macbeth,Tragedy,Porter,2,3,9,you'll sweat for't.,"['sweat', ""for't""]"
Macbeth,Tragedy,Porter,2,3,10,"Knock,",['Knock']
Macbeth,Tragedy,Porter,2,3,11,"knock! Who's there, in the other devil's","['knock', 'devil']"
Macbeth,Tragedy,Porter,2,3,12,"name? Faith, here's an equivocator, that could","['name', 'Faith', 'equivocator', 'could']"
Macbeth,Tragedy,Porter,2,3,13,swear in both the scales against either scale;,"['swear', 'scales', 'either', 'scale']"
Macbeth,Tragedy,Porter,2,3,14,"who committed treason enough for God's sake,","['committed', 'treason', 'enough', 'God', 'sake']"
Macbeth,Tragedy,Porter,2,3,15,"yet could not equivocate to heaven: O, come","['yet', 'could', 'equivocate', 'heaven', 'come']"
Macbeth,Tragedy,Porter,2,3,16,"in, equivocator.",['equivocator']
Macbeth,Tragedy,Porter,2,3,17,"Knock,",['Knock']
Macbeth,Tragedy,Porter,2,3,18,"knock, knock! Who's there? Faith, here's an","['knock', 'knock', 'Faith']"
Macbeth,Tragedy,Porter,2,3,19,"English tailor come hither, for stealing out of","['English', 'tailor', 'come', 'hither', 'stealing']"
Macbeth,Tragedy,Porter,2,3,20,"a French hose: come in, tailor; here you may","['French', 'hose', 'come', 'tailor', 'may']"
Macbeth,Tragedy,Porter,2,3,21,roast your goose.,"['roast', 'goose']"
Macbeth,Tragedy,Porter,2,3,22,"Knock,",['Knock']
Macbeth,Tragedy,Porter,2,3,23,knock; never at quiet! What are you? But,"['knock', 'never', 'quiet']"
Macbeth,Tragedy,Porter,2,3,24,this place is too cold for hell. I'll devil-porter,"['place', 'cold', 'hell', 'devil-porter']"
Macbeth,Tragedy,Porter,2,3,25,it no further: I had thought to have let in,"['thought', 'let']"
Macbeth,Tragedy,Porter,2,3,26,some of all professions that go the primrose,"['professions', 'go', 'primrose']"
Macbeth,Tragedy,Porter,2,3,27,way to the everlasting bonfire.,"['way', 'everlasting', 'bonfire']"
Macbeth,Tragedy,Porter,2,3,28,"Anon, anon! I pray you, remember the porter.","['pray', 'remember', 'porter']"
Macbeth,Tragedy,Macduff,2,3,29,"Was it so late, friend, ere you went to bed,","['late', 'friend', 'went', 'bed']"
Macbeth,Tragedy,Macduff,2,3,30,That you do lie so late?,"['lie', 'late']"
Macbeth,Tragedy,Porter,2,3,31,"'Faith sir, we were carousing till the","[""'Faith"", 'sir', 'carousing', 'till']"
Macbeth,Tragedy,Porter,2,3,32,"second cock: and drink, sir, is a great","['second', 'cock', 'drink', 'sir', 'great']"
Macbeth,Tragedy,Porter,2,3,33,provoker of three things.,"['provoker', 'three', 'things']"
Macbeth,Tragedy,Macduff,2,3,34,What three things does drink especially provoke?,"['three', 'things', 'drink', 'especially', 'provoke']"
Macbeth,Tragedy,Porter,2,3,35,"Marry, sir, nose-painting, sleep, and","['Marry', 'sir', 'nose-painting', 'sleep']"
Macbeth,Tragedy,Porter,2,3,36,"urine. Lechery, sir, it provokes, and unprovokes;","['urine', 'Lechery', 'sir', 'provokes', 'unprovokes']"
Macbeth,Tragedy,Porter,2,3,37,"it provokes the desire, but it takes","['provokes', 'desire', 'takes']"
Macbeth,Tragedy,Porter,2,3,38,"away the performance: therefore, much drink","['away', 'performance', 'therefore', 'much', 'drink']"
Macbeth,Tragedy,Porter,2,3,39,may be said to be an equivocator with lechery:,"['may', 'said', 'equivocator', 'lechery']"
Macbeth,Tragedy,Porter,2,3,40,"it makes him, and it mars him; it sets","['makes', 'mars', 'sets']"
Macbeth,Tragedy,Porter,2,3,41,"him on, and it takes him off; it persuades him,","['takes', 'persuades']"
Macbeth,Tragedy,Porter,2,3,42,"and disheartens him; makes him stand to, and","['disheartens', 'makes', 'stand']"
Macbeth,Tragedy,Porter,2,3,43,"not stand to; in conclusion, equivocates him","['stand', 'conclusion', 'equivocates']"
Macbeth,Tragedy,Porter,2,3,44,"in a sleep, and, giving him the lie, leaves him.","['sleep', 'giving', 'lie', 'leaves']"
