play_name,genre,character,act,scene,sentence,text,tokens
Macbeth,Tragedy,Macbeth,3,1,68,For Banquo's issue have I filed my mind;,"['issue', 'filed', 'mind']"
Macbeth,Tragedy,Macbeth,3,1,69,For them the gracious Duncan have I murder'd;,"['gracious', 'murder']"
Macbeth,Tragedy,Macbeth,3,1,70,Put rancours in the vessel of my peace,"['Put', 'rancours', 'vessel', 'peace']"
Macbeth,Tragedy,Macbeth,3,1,71,Only for them; and mine eternal jewel,"['eternal', 'jewel']"
Macbeth,Tragedy,Macbeth,3,1,72,"Given to the common enemy of man,","['Given', 'common', 'enemy', 'man']"
Macbeth,Tragedy,Macbeth,3,1,73,"To make them kings, the seed of Banquo kings!","['make', 'kings', 'seed', 'kings']"
Macbeth,Tragedy,Macbeth,3,1,74,"Rather than so, come fate into the list.","['Rather', 'come', 'fate', 'list']"
Macbeth,Tragedy,Macbeth,3,1,75,And champion me to the utterance! Who's there!,"['champion', 'utterance']"
Macbeth,Tragedy,Macbeth,3,1,76,"Now go to the door, and stay there till we call.","['go', 'door', 'stay', 'till', 'call']"
Macbeth,Tragedy,Macbeth,3,1,77,Was it not yesterday we spoke together?,"['yesterday', 'spoke', 'together']"
Macbeth,Tragedy,First Murderer,3,1,78,"It was, so please your highness.","['please', 'highness']"
Macbeth,Tragedy,Macbeth,3,1,79,"Well then, now",['Well']
Macbeth,Tragedy,Macbeth,3,1,80,Have you consider'd of my speeches? Know,"['consider', 'speeches', 'Know']"
Macbeth,Tragedy,Macbeth,3,1,81,That it was he in the times past which held you,"['times', 'past', 'held']"
Macbeth,Tragedy,Macbeth,3,1,82,"So under fortune, which you thought had been","['fortune', 'thought']"
Macbeth,Tragedy,Macbeth,3,1,83,Our innocent self: this I made good to you,"['innocent', 'self', 'made', 'good']"
Macbeth,Tragedy,Macbeth,3,1,84,"In our last conference, pass'd in probation with you,","['last', 'conference', 'pass', 'probation']"
Macbeth,Tragedy,Macbeth,3,1,85,"How you were borne in hand, how cross'd,","['borne', 'hand', 'cross']"
Macbeth,Tragedy,Macbeth,3,1,86,"the instruments,",['instruments']
Macbeth,Tragedy,Macbeth,3,1,87,"Who wrought with them, and all things else that might","['wrought', 'things', 'else', 'might']"
Macbeth,Tragedy,Macbeth,3,1,88,To half a soul and to a notion crazed,"['half', 'soul', 'notion', 'crazed']"
Macbeth,Tragedy,Macbeth,3,1,89,Say 'Thus did Banquo.',"['Say', ""'Thus""]"
Macbeth,Tragedy,First Murderer,3,1,90,You made it known to us.,"['made', 'known']"
Macbeth,Tragedy,Macbeth,3,1,91,"I did so, and went further, which is now",['went']
Macbeth,Tragedy,Macbeth,3,1,92,Our point of second meeting. Do you find,"['point', 'second', 'meeting', 'find']"
Macbeth,Tragedy,Macbeth,3,1,93,Your patience so predominant in your nature,"['patience', 'predominant', 'nature']"
Macbeth,Tragedy,Macbeth,3,1,94,That you can let this go? Are you so gospell'd,"['let', 'go', 'gospell']"
Macbeth,Tragedy,Macbeth,3,1,95,"To pray for this good man and for his issue,","['pray', 'good', 'man', 'issue']"
Macbeth,Tragedy,Macbeth,3,1,96,Whose heavy hand hath bow'd you to the grave,"['Whose', 'heavy', 'hand', 'bow', 'grave']"
Macbeth,Tragedy,Macbeth,3,1,97,And beggar'd yours for ever?,"['beggar', 'ever']"
Macbeth,Tragedy,First Murderer,3,1,98,"We are men, my liege.","['men', 'liege']"
Macbeth,Tragedy,Macbeth,3,1,99,"Ay, in the catalogue ye go for men;","['Ay', 'catalogue', 'go', 'men']"
Macbeth,Tragedy,Macbeth,3,1,100,"As hounds and greyhounds, mongrels, spaniels, curs,","['hounds', 'greyhounds', 'mongrels', 'spaniels', 'curs']"
Macbeth,Tragedy,Macbeth,3,1,101,"Shoughs, water-rugs and demi-wolves, are clept","['Shoughs', 'water-rugs', 'demi-wolves', 'clept']"
Macbeth,Tragedy,Macbeth,3,1,102,All by the name of dogs: the valued file,"['name', 'dogs', 'valued', 'file']"
Macbeth,Tragedy,Macbeth,3,1,103,"Distinguishes the swift, the slow, the subtle,","['Distinguishes', 'swift', 'slow', 'subtle']"
Macbeth,Tragedy,Macbeth,3,1,104,"The housekeeper, the hunter, every one","['housekeeper', 'hunter', 'every', 'one']"
Macbeth,Tragedy,Macbeth,3,1,105,According to the gift which bounteous nature,"['According', 'gift', 'bounteous', 'nature']"
Macbeth,Tragedy,Macbeth,3,1,106,Hath in him closed; whereby he does receive,"['closed', 'whereby', 'receive']"
Macbeth,Tragedy,Macbeth,3,1,107,Particular addition. from the bill,"['Particular', 'addition', 'bill']"
Macbeth,Tragedy,Macbeth,3,1,108,That writes them all alike: and so of men.,"['writes', 'alike', 'men']"
Macbeth,Tragedy,Macbeth,3,1,109,"Now, if you have a station in the file,","['station', 'file']"
Macbeth,Tragedy,Macbeth,3,1,110,"Not i' the worst rank of manhood, say 't;","['worst', 'rank', 'manhood', 'say', ""'t""]"
Macbeth,Tragedy,Macbeth,3,1,111,"And I will put that business in your bosoms,","['put', 'business', 'bosoms']"
Macbeth,Tragedy,Macbeth,3,1,112,"Whose execution takes your enemy off,","['Whose', 'execution', 'takes', 'enemy']"
Macbeth,Tragedy,Macbeth,3,1,113,"Grapples you to the heart and love of us,","['Grapples', 'heart', 'love']"
Macbeth,Tragedy,Macbeth,3,1,114,"Who wear our health but sickly in his life,","['wear', 'health', 'sickly', 'life']"
Macbeth,Tragedy,Macbeth,3,1,115,Which in his death were perfect.,"['death', 'perfect']"
Macbeth,Tragedy,Second Murderer,3,1,116,"I am one, my liege,","['one', 'liege']"
Macbeth,Tragedy,Second Murderer,3,1,117,Whom the vile blows and buffets of the world,"['vile', 'blows', 'buffets', 'world']"
Macbeth,Tragedy,Second Murderer,3,1,118,Have so incensed that I am reckless what,"['incensed', 'reckless']"
Macbeth,Tragedy,Second Murderer,3,1,119,I do to spite the world.,"['spite', 'world']"
Macbeth,Tragedy,First Murderer,3,1,120,And I another,['another']
Macbeth,Tragedy,First Murderer,3,1,121,"So weary with disasters, tugg'd with fortune,","['weary', 'disasters', 'tugg', 'fortune']"
Macbeth,Tragedy,First Murderer,3,1,122,"That I would set my lie on any chance,","['would', 'set', 'lie', 'chance']"
Macbeth,Tragedy,First Murderer,3,1,123,"To mend it, or be rid on't.","['mend', 'rid', ""n't""]"
Macbeth,Tragedy,Macbeth,3,1,124,Both of you,[]
Macbeth,Tragedy,Macbeth,3,1,125,Know Banquo was your enemy.,"['Know', 'enemy']"
Macbeth,Tragedy,Both Murderers,3,1,126,"True, my lord.","['True', 'lord']"
Macbeth,Tragedy,Macbeth,3,1,127,"So is he mine; and in such bloody distance,","['bloody', 'distance']"
Macbeth,Tragedy,Macbeth,3,1,128,That every minute of his being thrusts,"['every', 'minute', 'thrusts']"
Macbeth,Tragedy,Macbeth,3,1,129,Against my near'st of life: and though I could,"[""near'st"", 'life', 'though', 'could']"
Macbeth,Tragedy,Macbeth,3,1,130,With barefaced power sweep him from my sight,"['barefaced', 'power', 'sweep', 'sight']"
Macbeth,Tragedy,Macbeth,3,1,131,"And bid my will avouch it, yet I must not,","['bid', 'avouch', 'yet', 'must']"
Macbeth,Tragedy,Macbeth,3,1,132,"For certain friends that are both his and mine,","['certain', 'friends']"
Macbeth,Tragedy,Macbeth,3,1,133,"Whose loves I may not drop, but wail his fall","['Whose', 'loves', 'may', 'drop', 'wail', 'fall']"
Macbeth,Tragedy,Macbeth,3,1,134,"Who I myself struck down; and thence it is,","['struck', 'thence']"
Macbeth,Tragedy,Macbeth,3,1,135,"That I to your assistance do make love,","['assistance', 'make', 'love']"
Macbeth,Tragedy,Macbeth,3,1,136,Masking the business from the common eye,"['Masking', 'business', 'common', 'eye']"
Macbeth,Tragedy,Macbeth,3,1,137,For sundry weighty reasons.,"['sundry', 'weighty', 'reasons']"
Macbeth,Tragedy,Second Murderer,3,1,138,"We shall, my lord,","['shall', 'lord']"
Macbeth,Tragedy,Second Murderer,3,1,139,Perform what you command us.,"['Perform', 'command']"
Macbeth,Tragedy,First Murderer,3,1,140,Though our lives--,"['Though', 'lives']"
Macbeth,Tragedy,Macbeth,3,1,141,Your spirits shine through you. Within this hour at most,"['spirits', 'shine', 'Within', 'hour']"
Macbeth,Tragedy,Macbeth,3,1,142,I will advise you where to plant yourselves;,"['advise', 'plant']"
Macbeth,Tragedy,Macbeth,3,1,143,"Acquaint you with the perfect spy o' the time,","['Acquaint', 'perfect', 'spy', 'time']"
Macbeth,Tragedy,Macbeth,3,1,144,"The moment on't; for't must be done to-night,","['moment', ""n't"", ""for't"", 'must', 'done', 'to-night']"
Macbeth,Tragedy,Macbeth,3,1,145,And something from the palace; always thought,"['something', 'palace', 'always', 'thought']"
Macbeth,Tragedy,Macbeth,3,1,146,That I require a clearness: and with him--,"['require', 'clearness']"
Macbeth,Tragedy,Macbeth,3,1,147,To leave no rubs nor botches in the work--,"['leave', 'rubs', 'botches', 'work']"
Macbeth,Tragedy,Macbeth,3,1,148,"Fleance his son, that keeps him company,","['son', 'keeps', 'company']"
Macbeth,Tragedy,Macbeth,3,1,149,Whose absence is no less material to me,"['Whose', 'absence', 'less', 'material']"
Macbeth,Tragedy,Macbeth,3,1,150,"Than is his father's, must embrace the fate","['father', 'must', 'embrace', 'fate']"
Macbeth,Tragedy,Macbeth,3,1,151,Of that dark hour. Resolve yourselves apart:,"['dark', 'hour', 'Resolve', 'apart']"
Macbeth,Tragedy,Macbeth,3,1,152,I'll come to you anon.,['come']
Macbeth,Tragedy,Both Murderers,3,1,153,"We are resolved, my lord.","['resolved', 'lord']"
Macbeth,Tragedy,Macbeth,3,1,154,I'll call upon you straight: abide within.,"['call', 'upon', 'straight', 'abide', 'within']"
Macbeth,Tragedy,Macbeth,3,1,155,"It is concluded. Banquo, thy soul's flight,","['concluded', 'soul', 'flight']"
Macbeth,Tragedy,Macbeth,3,1,156,"If it find heaven, must find it out to-night.","['find', 'heaven', 'must', 'find', 'to-night']"
Macbeth,Tragedy,Lady Macbeth,3,2,1,Is Banquo gone from court?,"['gone', 'court']"
Macbeth,Tragedy,Servant,3,2,2,"Ay, madam, but returns again to-night.","['Ay', 'madam', 'returns', 'to-night']"
Macbeth,Tragedy,Lady Macbeth,3,2,3,"Say to the king, I would attend his leisure","['Say', 'king', 'would', 'attend', 'leisure']"
Macbeth,Tragedy,Lady Macbeth,3,2,4,For a few words.,['words']
Macbeth,Tragedy,Servant,3,2,5,"Madam, I will.",['Madam']
Macbeth,Tragedy,Lady Macbeth,3,2,6,"Nought's had, all's spent,","['Nought', 'spent']"
Macbeth,Tragedy,Lady Macbeth,3,2,7,Where our desire is got without content:,"['desire', 'got', 'without', 'content']"
Macbeth,Tragedy,Lady Macbeth,3,2,8,'Tis safer to be that which we destroy,"[""'T"", 'safer', 'destroy']"
Macbeth,Tragedy,Lady Macbeth,3,2,9,Than by destruction dwell in doubtful joy.,"['destruction', 'dwell', 'doubtful', 'joy']"
Macbeth,Tragedy,Lady Macbeth,3,2,10,"How now, my lord! why do you keep alone,","['lord', 'keep', 'alone']"
Macbeth,Tragedy,Lady Macbeth,3,2,11,"Of sorriest fancies your companions making,","['sorriest', 'fancies', 'companions', 'making']"
Macbeth,Tragedy,Lady Macbeth,3,2,12,Using those thoughts which should indeed have died,"['Using', 'thoughts', 'indeed', 'died']"
Macbeth,Tragedy,Lady Macbeth,3,2,13,With them they think on? Things without all remedy,"['think', 'Things', 'without', 'remedy']"
Macbeth,Tragedy,Lady Macbeth,3,2,14,Should be without regard: what's done is done.,"['without', 'regard', 'done', 'done']"
Macbeth,Tragedy,Macbeth,3,2,15,"We have scotch'd the snake, not kill'd it:","['scotch', 'snake', 'kill']"
Macbeth,Tragedy,Macbeth,3,2,16,"She'll close and be herself, whilst our poor malice","['close', 'whilst', 'poor', 'malice']"
Macbeth,Tragedy,Macbeth,3,2,17,Remains in danger of her former tooth.,"['Remains', 'danger', 'former', 'tooth']"
Macbeth,Tragedy,Macbeth,3,2,18,"But let the frame of things disjoint, both the","['let', 'frame', 'things', 'disjoint']"
Macbeth,Tragedy,Macbeth,3,2,19,"worlds suffer,","['worlds', 'suffer']"
Macbeth,Tragedy,Macbeth,3,2,20,Ere we will eat our meal in fear and sleep,"['eat', 'meal', 'fear', 'sleep']"
Macbeth,Tragedy,Macbeth,3,2,21,In the affliction of these terrible dreams,"['affliction', 'terrible', 'dreams']"
Macbeth,Tragedy,Macbeth,3,2,22,"That shake us nightly: better be with the dead,","['shake', 'nightly', 'better', 'dead']"
Macbeth,Tragedy,Macbeth,3,2,23,"Whom we, to gain our peace, have sent to peace,","['gain', 'peace', 'sent', 'peace']"
Macbeth,Tragedy,Macbeth,3,2,24,Than on the torture of the mind to lie,"['torture', 'mind', 'lie']"
Macbeth,Tragedy,Macbeth,3,2,25,In restless ecstasy. Duncan is in his grave;,"['restless', 'ecstasy', 'grave']"
Macbeth,Tragedy,Macbeth,3,2,26,After life's fitful fever he sleeps well;,"['life', 'fitful', 'fever', 'sleeps', 'well']"
Macbeth,Tragedy,Macbeth,3,2,27,"Treason has done his worst: nor steel, nor poison,","['Treason', 'done', 'worst', 'steel', 'poison']"
Macbeth,Tragedy,Macbeth,3,2,28,"Malice domestic, foreign levy, nothing,","['Malice', 'domestic', 'foreign', 'levy', 'nothing']"
Macbeth,Tragedy,Macbeth,3,2,29,Can touch him further.,['touch']
Macbeth,Tragedy,Lady Macbeth,3,2,30,Come on;,['Come']
Macbeth,Tragedy,Lady Macbeth,3,2,31,"Gentle my lord, sleek o'er your rugged looks;","['Gentle', 'lord', 'sleek', ""o'er"", 'rugged', 'looks']"
Macbeth,Tragedy,Lady Macbeth,3,2,32,Be bright and jovial among your guests to-night.,"['bright', 'jovial', 'among', 'guests', 'to-night']"
Macbeth,Tragedy,Macbeth,3,2,33,"So shall I, love; and so, I pray, be you:","['shall', 'love', 'pray']"
Macbeth,Tragedy,Macbeth,3,2,34,Let your remembrance apply to Banquo;,"['Let', 'remembrance', 'apply']"
Macbeth,Tragedy,Macbeth,3,2,35,"Present him eminence, both with eye and tongue:","['Present', 'eminence', 'eye', 'tongue']"
Macbeth,Tragedy,Macbeth,3,2,36,"Unsafe the while, that we",['Unsafe']
Macbeth,Tragedy,Macbeth,3,2,37,"Must lave our honours in these flattering streams,","['Must', 'lave', 'honours', 'flattering', 'streams']"
Macbeth,Tragedy,Macbeth,3,2,38,"And make our faces vizards to our hearts,","['make', 'faces', 'vizards', 'hearts']"
Macbeth,Tragedy,Macbeth,3,2,39,Disguising what they are.,['Disguising']
Macbeth,Tragedy,Lady Macbeth,3,2,40,You must leave this.,"['must', 'leave']"
Macbeth,Tragedy,Macbeth,3,2,41,"O, full of scorpions is my mind, dear wife!","['full', 'scorpions', 'mind', 'dear', 'wife']"
Macbeth,Tragedy,Macbeth,3,2,42,"Thou know'st that Banquo, and his Fleance, lives.","[""know'st"", 'lives']"
Macbeth,Tragedy,Lady Macbeth,3,2,43,But in them nature's copy's not eterne.,"['nature', 'copy', 'eterne']"
Macbeth,Tragedy,Macbeth,3,2,44,There's comfort yet; they are assailable;,"['comfort', 'yet', 'assailable']"
Macbeth,Tragedy,Macbeth,3,2,45,Then be thou jocund: ere the bat hath flown,"['jocund', 'bat', 'flown']"
Macbeth,Tragedy,Macbeth,3,2,46,"His cloister'd flight, ere to black Hecate's summons","['cloister', 'flight', 'black', 'summons']"
Macbeth,Tragedy,Macbeth,3,2,47,The shard-borne beetle with his drowsy hums,"['shard-borne', 'beetle', 'drowsy', 'hums']"
Macbeth,Tragedy,Macbeth,3,2,48,"Hath rung night's yawning peal, there shall be done","['rung', 'night', 'yawning', 'peal', 'shall', 'done']"
Macbeth,Tragedy,Macbeth,3,2,49,A deed of dreadful note.,"['deed', 'dreadful', 'note']"
Macbeth,Tragedy,Lady Macbeth,3,2,50,What's to be done?,['done']
Macbeth,Tragedy,Macbeth,3,2,51,"Be innocent of the knowledge, dearest chuck,","['innocent', 'knowledge', 'dearest', 'chuck']"
Macbeth,Tragedy,Macbeth,3,2,52,"Till thou applaud the deed. Come, seeling night,","['Till', 'applaud', 'deed', 'Come', 'seeling', 'night']"
Macbeth,Tragedy,Macbeth,3,2,53,Scarf up the tender eye of pitiful day;,"['Scarf', 'tender', 'eye', 'pitiful', 'day']"
Macbeth,Tragedy,Macbeth,3,2,54,And with thy bloody and invisible hand,"['bloody', 'invisible', 'hand']"
Macbeth,Tragedy,Macbeth,3,2,55,Cancel and tear to pieces that great bond,"['Cancel', 'tear', 'pieces', 'great', 'bond']"
Macbeth,Tragedy,Macbeth,3,2,56,Which keeps me pale! Light thickens; and the crow,"['keeps', 'pale', 'Light', 'thickens', 'crow']"
Macbeth,Tragedy,Macbeth,3,2,57,Makes wing to the rooky wood:,"['Makes', 'wing', 'rooky', 'wood']"
Macbeth,Tragedy,Macbeth,3,2,58,Good things of day begin to droop and drowse;,"['Good', 'things', 'day', 'begin', 'droop', 'drowse']"
Macbeth,Tragedy,Macbeth,3,2,59,While night's black agents to their preys do rouse.,"['night', 'black', 'agents', 'preys', 'rouse']"
Macbeth,Tragedy,Macbeth,3,2,60,Thou marvell'st at my words: but hold thee still;,"[""marvell'st"", 'words', 'hold', 'still']"
Macbeth,Tragedy,Macbeth,3,2,61,Things bad begun make strong themselves by ill.,"['Things', 'bad', 'begun', 'make', 'strong', 'ill']"
Macbeth,Tragedy,Macbeth,3,2,62,"So, prithee, go with me.","['prithee', 'go']"
Macbeth,Tragedy,First Murderer,3,3,1,But who did bid thee join with us?,"['bid', 'join']"
Macbeth,Tragedy,Third Murderer,3,3,2,Macbeth.,[]
Macbeth,Tragedy,Second Murderer,3,3,3,"He needs not our mistrust, since he delivers","['needs', 'mistrust', 'since', 'delivers']"
Macbeth,Tragedy,Second Murderer,3,3,4,Our offices and what we have to do,['offices']
Macbeth,Tragedy,Second Murderer,3,3,5,To the direction just.,['direction']
Macbeth,Tragedy,First Murderer,3,3,6,Then stand with us.,['stand']
Macbeth,Tragedy,First Murderer,3,3,7,The west yet glimmers with some streaks of day:,"['west', 'yet', 'glimmers', 'streaks', 'day']"
Macbeth,Tragedy,First Murderer,3,3,8,Now spurs the lated traveller apace,"['spurs', 'lated', 'traveller', 'apace']"
Macbeth,Tragedy,First Murderer,3,3,9,To gain the timely inn; and near approaches,"['gain', 'timely', 'inn', 'near', 'approaches']"
Macbeth,Tragedy,First Murderer,3,3,10,The subject of our watch.,"['subject', 'watch']"
Macbeth,Tragedy,Third Murderer,3,3,11,Hark! I hear horses.,"['Hark', 'hear', 'horses']"
Macbeth,Tragedy,Banquo,3,3,12,"[Within]  Give us a light there, ho!","['Within', 'Give', 'light', 'ho']"
Macbeth,Tragedy,Second Murderer,3,3,13,Then 'tis he: the rest,"[""'t"", 'rest']"
Macbeth,Tragedy,Second Murderer,3,3,14,That are within the note of expectation,"['within', 'note', 'expectation']"
Macbeth,Tragedy,Second Murderer,3,3,15,Already are i' the court.,"['Already', 'court']"
Macbeth,Tragedy,First Murderer,3,3,16,His horses go about.,"['horses', 'go']"
Macbeth,Tragedy,Third Murderer,3,3,17,"Almost a mile: but he does usually,","['Almost', 'mile', 'usually']"
Macbeth,Tragedy,Third Murderer,3,3,18,"So all men do, from hence to the palace gate","['men', 'palace', 'gate']"
Macbeth,Tragedy,Third Murderer,3,3,19,Make it their walk.,"['Make', 'walk']"
Macbeth,Tragedy,Second Murderer,3,3,20,"A light, a light!","['light', 'light']"
Macbeth,Tragedy,Third Murderer,3,3,21,'Tis he.,"[""'T""]"
Macbeth,Tragedy,First Murderer,3,3,22,Stand to't.,"['Stand', ""to't""]"
Macbeth,Tragedy,Banquo,3,3,23,It will be rain to-night.,"['rain', 'to-night']"
Macbeth,Tragedy,First Murderer,3,3,24,Let it come down.,"['Let', 'come']"
Macbeth,Tragedy,Banquo,3,3,25,"O, treachery! Fly, good Fleance, fly, fly, fly!","['treachery', 'Fly', 'good', 'fly', 'fly', 'fly']"
Macbeth,Tragedy,Banquo,3,3,26,Thou mayst revenge. O slave!,"['mayst', 'revenge', 'slave']"
Macbeth,Tragedy,Third Murderer,3,3,27,Who did strike out the light?,"['strike', 'light']"
Macbeth,Tragedy,First Murderer,3,3,28,Wast not the way?,"['Wast', 'way']"
Macbeth,Tragedy,Third Murderer,3,3,29,There's but one down; the son is fled.,"['one', 'son', 'fled']"
Macbeth,Tragedy,Second Murderer,3,3,30,We have lost,['lost']
Macbeth,Tragedy,Second Murderer,3,3,31,Best half of our affair.,"['Best', 'half', 'affair']"
Macbeth,Tragedy,First Murderer,3,3,32,"Well, let's away, and say how much is done.","['Well', 'let', 'away', 'say', 'much', 'done']"
Macbeth,Tragedy,Macbeth,3,4,1,You know your own degrees; sit down: at first,"['know', 'degrees', 'sit', 'first']"
Macbeth,Tragedy,Macbeth,3,4,2,And last the hearty welcome.,"['last', 'hearty', 'welcome']"
Macbeth,Tragedy,Lords,3,4,3,Thanks to your majesty.,"['Thanks', 'majesty']"
Macbeth,Tragedy,Macbeth,3,4,4,"Ourself will mingle with society,","['Ourself', 'mingle', 'society']"
Macbeth,Tragedy,Macbeth,3,4,5,And play the humble host.,"['play', 'humble', 'host']"
Macbeth,Tragedy,Macbeth,3,4,6,"Our hostess keeps her state, but in best time","['hostess', 'keeps', 'state', 'best', 'time']"
Macbeth,Tragedy,Macbeth,3,4,7,We will require her welcome.,"['require', 'welcome']"
Macbeth,Tragedy,Lady Macbeth,3,4,8,"Pronounce it for me, sir, to all our friends;","['Pronounce', 'sir', 'friends']"
Macbeth,Tragedy,Lady Macbeth,3,4,9,For my heart speaks they are welcome.,"['heart', 'speaks', 'welcome']"
Macbeth,Tragedy,Macbeth,3,4,10,"See, they encounter thee with their hearts' thanks.","['See', 'encounter', 'hearts', 'thanks']"
Macbeth,Tragedy,Macbeth,3,4,11,Both sides are even: here I'll sit i' the midst:,"['sides', 'even', 'sit', 'midst']"
Macbeth,Tragedy,Macbeth,3,4,12,Be large in mirth; anon we'll drink a measure,"['large', 'mirth', 'drink', 'measure']"
Macbeth,Tragedy,Macbeth,3,4,13,The table round.,"['table', 'round']"
Macbeth,Tragedy,Macbeth,3,4,14,There's blood on thy face.,"['blood', 'face']"
Macbeth,Tragedy,First Murderer,3,4,15,'Tis Banquo's then.,"[""'T""]"
Macbeth,Tragedy,Macbeth,3,4,16,'Tis better thee without than he within.,"[""'T"", 'better', 'without', 'within']"
Macbeth,Tragedy,Macbeth,3,4,17,Is he dispatch'd?,['dispatch']
Macbeth,Tragedy,First Murderer,3,4,18,"My lord, his throat is cut; that I did for him.","['lord', 'throat', 'cut']"
Macbeth,Tragedy,Macbeth,3,4,19,Thou art the best o' the cut-throats: yet he's good,"['best', 'cut-throats', 'yet', 'good']"
Macbeth,Tragedy,Macbeth,3,4,20,"That did the like for Fleance: if thou didst it,","['like', 'didst']"
Macbeth,Tragedy,Macbeth,3,4,21,Thou art the nonpareil.,['nonpareil']
Macbeth,Tragedy,First Murderer,3,4,22,"Most royal sir,","['royal', 'sir']"
Macbeth,Tragedy,First Murderer,3,4,23,Fleance is 'scaped.,"[""'scaped""]"
Macbeth,Tragedy,Macbeth,3,4,24,"Then comes my fit again: I had else been perfect,","['comes', 'fit', 'else', 'perfect']"
Macbeth,Tragedy,Macbeth,3,4,25,"Whole as the marble, founded as the rock,","['Whole', 'marble', 'founded', 'rock']"
Macbeth,Tragedy,Macbeth,3,4,26,As broad and general as the casing air:,"['broad', 'general', 'casing', 'air']"
Macbeth,Tragedy,Macbeth,3,4,27,"But now I am cabin'd, cribb'd, confined, bound in","['cabin', 'cribb', 'confined', 'bound']"
Macbeth,Tragedy,Macbeth,3,4,28,To saucy doubts and fears. But Banquo's safe?,"['saucy', 'doubts', 'fears', 'safe']"
Macbeth,Tragedy,First Murderer,3,4,29,"Ay, my good lord: safe in a ditch he bides,","['Ay', 'good', 'lord', 'safe', 'ditch', 'bides']"
Macbeth,Tragedy,First Murderer,3,4,30,With twenty trenched gashes on his head;,"['twenty', 'trenched', 'gashes', 'head']"
Macbeth,Tragedy,First Murderer,3,4,31,The least a death to nature.,"['least', 'death', 'nature']"
Macbeth,Tragedy,Macbeth,3,4,32,Thanks for that:,['Thanks']
Macbeth,Tragedy,Macbeth,3,4,33,There the grown serpent lies; the worm that's fled,"['grown', 'serpent', 'lies', 'worm', 'fled']"
Macbeth,Tragedy,Macbeth,3,4,34,"Hath nature that in time will venom breed,","['nature', 'time', 'venom', 'breed']"
Macbeth,Tragedy,Macbeth,3,4,35,No teeth for the present. Get thee gone: to-morrow,"['teeth', 'present', 'Get', 'gone', 'to-morrow']"
Macbeth,Tragedy,Macbeth,3,4,36,"We'll hear, ourselves, again.",['hear']
Macbeth,Tragedy,Lady Macbeth,3,4,37,"My royal lord,","['royal', 'lord']"
Macbeth,Tragedy,Lady Macbeth,3,4,38,You do not give the cheer: the feast is sold,"['give', 'cheer', 'feast', 'sold']"
Macbeth,Tragedy,Lady Macbeth,3,4,39,"That is not often vouch'd, while 'tis a-making,","['often', 'vouch', ""'t"", 'a-making']"
Macbeth,Tragedy,Lady Macbeth,3,4,40,'Tis given with welcome: to feed were best at home;,"[""'T"", 'given', 'welcome', 'feed', 'best', 'home']"
Macbeth,Tragedy,Lady Macbeth,3,4,41,From thence the sauce to meat is ceremony;,"['thence', 'sauce', 'meat', 'ceremony']"
Macbeth,Tragedy,Lady Macbeth,3,4,42,Meeting were bare without it.,"['Meeting', 'bare', 'without']"
Macbeth,Tragedy,Macbeth,3,4,43,Sweet remembrancer!,"['Sweet', 'remembrancer']"
Macbeth,Tragedy,Macbeth,3,4,44,"Now, good digestion wait on appetite,","['good', 'digestion', 'wait', 'appetite']"
Macbeth,Tragedy,Macbeth,3,4,45,And health on both!,['health']
Macbeth,Tragedy,Lennox,3,4,46,May't please your highness sit.,"[""May't"", 'please', 'highness', 'sit']"
Macbeth,Tragedy,Macbeth,3,4,47,"Here had we now our country's honour roof'd,","['country', 'honour', 'roof']"
Macbeth,Tragedy,Macbeth,3,4,48,Were the graced person of our Banquo present;,"['graced', 'person', 'present']"
Macbeth,Tragedy,Macbeth,3,4,49,Who may I rather challenge for unkindness,"['may', 'rather', 'challenge', 'unkindness']"
Macbeth,Tragedy,Macbeth,3,4,50,Than pity for mischance!,"['pity', 'mischance']"
Macbeth,Tragedy,Ross,3,4,51,"His absence, sir,","['absence', 'sir']"
Macbeth,Tragedy,Ross,3,4,52,Lays blame upon his promise. Please't your highness,"['Lays', 'blame', 'upon', 'promise', ""Please't"", 'highness']"
Macbeth,Tragedy,Ross,3,4,53,To grace us with your royal company.,"['grace', 'royal', 'company']"
Macbeth,Tragedy,Macbeth,3,4,54,The table's full.,"['table', 'full']"
Macbeth,Tragedy,Lennox,3,4,55,"Here is a place reserved, sir.","['place', 'reserved', 'sir']"
Macbeth,Tragedy,Macbeth,3,4,56,Where?,[]
Macbeth,Tragedy,Lennox,3,4,57,"Here, my good lord. What is't that moves your highness?","['good', 'lord', ""is't"", 'moves', 'highness']"
Macbeth,Tragedy,Macbeth,3,4,58,Which of you have done this?,['done']
Macbeth,Tragedy,Lords,3,4,59,"What, my good lord?","['good', 'lord']"
Macbeth,Tragedy,Macbeth,3,4,60,Thou canst not say I did it: never shake,"['canst', 'say', 'never', 'shake']"
Macbeth,Tragedy,Macbeth,3,4,61,Thy gory locks at me.,"['gory', 'locks']"
Macbeth,Tragedy,Ross,3,4,62,"Gentlemen, rise: his highness is not well.","['Gentlemen', 'rise', 'highness', 'well']"
Macbeth,Tragedy,Lady Macbeth,3,4,63,"Sit, worthy friends: my lord is often thus,","['Sit', 'worthy', 'friends', 'lord', 'often', 'thus']"
Macbeth,Tragedy,Lady Macbeth,3,4,64,"And hath been from his youth: pray you, keep seat;","['youth', 'pray', 'keep', 'seat']"
Macbeth,Tragedy,Lady Macbeth,3,4,65,The fit is momentary; upon a thought,"['fit', 'momentary', 'upon', 'thought']"
Macbeth,Tragedy,Lady Macbeth,3,4,66,"He will again be well: if much you note him,","['well', 'much', 'note']"
