play_name,character,act,scene,sentence,text,tokens,sentiment_score
Tamburlaine the Great-Part1,MYCETES,SCENE II.,SCENE II.,10,"Aurora shall not peep out of her doors,","['Aurora', 'shall', 'peep', 'doors']",0.0
Tamburlaine the Great-Part1,MYCETES,SCENE II.,SCENE II.,11,"But I will have Cosroe by the head,","['Cosroe', 'head']",0.0
Tamburlaine the Great-Part1,MYCETES,SCENE II.,SCENE II.,12,And kill proud Tamburlaine with point of sword.,"['kill', 'proud', 'Tamburlaine', 'point', 'sword']",-0.3818
Tamburlaine the Great-Part1,MYCETES,SCENE II.,SCENE II.,13,"Tell you the rest, Meander:  I have said.","['Tell', 'rest', 'Meander', 'said']",0.0
Tamburlaine the Great-Part1,MEANDER,SCENE II.,SCENE II.,1,"Then, having pass'd Armenian deserts now,","['pass', 'Armenian', 'deserts']",0.0
Tamburlaine the Great-Part1,MEANDER,SCENE II.,SCENE II.,2,"And pitch'd our tents under the Georgian hills,","['pitch', 'tents', 'Georgian', 'hills']",0.0
Tamburlaine the Great-Part1,MEANDER,SCENE II.,SCENE II.,3,"Whose tops are cover'd with Tartarian thieves,","['Whose', 'tops', 'cover', 'Tartarian', 'thieves']",0.0
Tamburlaine the Great-Part1,MEANDER,SCENE II.,SCENE II.,4,"That lie in ambush, waiting for a prey,","['lie', 'ambush', 'waiting', 'prey']",0.0
Tamburlaine the Great-Part1,MEANDER,SCENE II.,SCENE II.,5,"What should we do but bid them battle straight,","['bid', 'battle', 'straight']",-0.2617
Tamburlaine the Great-Part1,MEANDER,SCENE II.,SCENE II.,6,And rid the world of those detested troops?,"['rid', 'world', 'detested', 'troops']",0.0
Tamburlaine the Great-Part1,MEANDER,SCENE II.,SCENE II.,7,"Lest, if we let them linger here a while,","['Lest', 'let', 'linger']",0.0
Tamburlaine the Great-Part1,MEANDER,SCENE II.,SCENE II.,8,They gather strength by power of fresh supplies.,"['gather', 'strength', 'power', 'fresh', 'supplies']",0.6705
Tamburlaine the Great-Part1,MEANDER,SCENE II.,SCENE II.,9,This country swarms with vile outragious men,"['country', 'swarms', 'vile', 'outragious', 'men']",-0.6249
Tamburlaine the Great-Part1,MEANDER,SCENE II.,SCENE II.,10,"That live by rapine and by lawless spoil,","['live', 'rapine', 'lawless', 'spoil']",0.0
Tamburlaine the Great-Part1,MEANDER,SCENE II.,SCENE II.,11,Fit soldiers for the  wicked Tamburlaine;,"['Fit', 'soldiers', 'wicked', 'Tamburlaine']",-0.2263
Tamburlaine the Great-Part1,MEANDER,SCENE II.,SCENE II.,12,And he that could with gifts and promises,"['could', 'gifts', 'promises']",0.3818
Tamburlaine the Great-Part1,MEANDER,SCENE II.,SCENE II.,13,"Inveigle him that led a thousand horse,","['Inveigle', 'led', 'thousand', 'horse']",0.0
Tamburlaine the Great-Part1,MEANDER,SCENE II.,SCENE II.,14,"And make him false his faith unto his  king,","['make', 'false', 'faith', 'unto', 'king']",0.4215
Tamburlaine the Great-Part1,MEANDER,SCENE II.,SCENE II.,15,Will quickly win such as be  like himself.,"['quickly', 'win', 'like']",0.743
Tamburlaine the Great-Part1,MEANDER,SCENE II.,SCENE II.,16,Therefore cheer up your minds; prepare to fight:,"['Therefore', 'cheer', 'minds', 'prepare', 'fight']",0.1779
Tamburlaine the Great-Part1,MEANDER,SCENE II.,SCENE II.,17,"He that can take or slaughter Tamburlaine,","['take', 'slaughter', 'Tamburlaine']",0.0
Tamburlaine the Great-Part1,MEANDER,SCENE II.,SCENE II.,18,Shall rule the province of Albania;,"['Shall', 'rule', 'province', 'Albania']",0.0
Tamburlaine the Great-Part1,MEANDER,SCENE II.,SCENE II.,19,"Who brings that traitor's head, Theridamas,","['brings', 'traitor', 'head', 'Theridamas']",0.0
Tamburlaine the Great-Part1,MEANDER,SCENE II.,SCENE II.,20,"Shall have a government in Media,","['Shall', 'government', 'Media']",0.0
Tamburlaine the Great-Part1,MEANDER,SCENE II.,SCENE II.,21,Beside  the spoil of him and all his train:,"['Beside', 'spoil', 'train']",0.0
Tamburlaine the Great-Part1,MEANDER,SCENE II.,SCENE II.,22,"But, if Cosroe (as our spials say,","['Cosroe', 'spials', 'say']",0.0
Tamburlaine the Great-Part1,MEANDER,SCENE II.,SCENE II.,23,"And as we know) remains with Tamburlaine,","['know', 'remains', 'Tamburlaine']",0.0
Tamburlaine the Great-Part1,MEANDER,SCENE II.,SCENE II.,24,"His highness' pleasure is that he should live,","['highness', 'pleasure', 'live']",0.5719
Tamburlaine the Great-Part1,MEANDER,SCENE II.,SCENE II.,25,And be reclaim'd with princely lenity.,"['reclaim', 'princely', 'lenity']",0.0
Tamburlaine the Great-Part1,SPY,SCENE II.,SCENE II.,1,"An hundred horsemen of my company,","['hundred', 'horsemen', 'company']",0.0
Tamburlaine the Great-Part1,SPY,SCENE II.,SCENE II.,2,"Scouting abroad upon these champion  plains,","['Scouting', 'abroad', 'upon', 'champion', 'plains']",0.5994
Tamburlaine the Great-Part1,SPY,SCENE II.,SCENE II.,3,Have view'd the army of the Scythians;,"['view', 'army', 'Scythians']",0.0
Tamburlaine the Great-Part1,SPY,SCENE II.,SCENE II.,4,Which make report it far exceeds the king's.,"['make', 'report', 'far', 'exceeds', 'king']",0.0
Tamburlaine the Great-Part1,MEANDER,SCENE II.,SCENE II.,1,"Suppose they be in number infinite,","['Suppose', 'number', 'infinite']",0.0772
Tamburlaine the Great-Part1,MEANDER,SCENE II.,SCENE II.,2,"Yet being void of martial discipline,","['Yet', 'void', 'martial', 'discipline']",0.0
Tamburlaine the Great-Part1,MEANDER,SCENE II.,SCENE II.,3,"All running headlong, greedy after  spoils,","['running', 'headlong', 'greedy', 'spoils']",-0.3182
Tamburlaine the Great-Part1,MEANDER,SCENE II.,SCENE II.,4,"And more regarding gain than victory,","['regarding', 'gain', 'victory']",0.5688
Tamburlaine the Great-Part1,MEANDER,SCENE II.,SCENE II.,5,"Like to the cruel brothers of the earth,","['Like', 'cruel', 'brothers', 'earth']",-0.3182
Tamburlaine the Great-Part1,MEANDER,SCENE II.,SCENE II.,6,"Sprung  of the teeth of  dragons venomous,","['Sprung', 'teeth', 'dragons', 'venomous']",0.0
Tamburlaine the Great-Part1,MEANDER,SCENE II.,SCENE II.,7,"Their careless swords shall lance  their fellows' throats,","['careless', 'swords', 'shall', 'lance', 'fellows', 'throats']",-0.3612
Tamburlaine the Great-Part1,MEANDER,SCENE II.,SCENE II.,8,And make us triumph in their overthrow.,"['make', 'triumph', 'overthrow']",0.4767
Tamburlaine the Great-Part1,MYCETES,SCENE II.,SCENE II.,1,"Was there such brethren, sweet Meander, say,","['brethren', 'sweet', 'Meander', 'say']",0.4588
Tamburlaine the Great-Part1,MYCETES,SCENE II.,SCENE II.,2,That sprung of teeth of dragons venomous?,"['sprung', 'teeth', 'dragons', 'venomous']",0.0
Tamburlaine the Great-Part1,MEANDER,SCENE II.,SCENE II.,1,"So poets say, my lord.","['poets', 'say', 'lord']",0.0
Tamburlaine the Great-Part1,MYCETES,SCENE II.,SCENE II.,1,And 'tis a pretty toy to be a poet.,"[""'t"", 'pretty', 'toy', 'poet']",0.4939
Tamburlaine the Great-Part1,MYCETES,SCENE II.,SCENE II.,2,"Well, well, Meander, thou art deeply read;","['Well', 'well', 'Meander', 'deeply', 'read']",0.4939
Tamburlaine the Great-Part1,MYCETES,SCENE II.,SCENE II.,3,"And having thee, I have a jewel sure.","['jewel', 'sure']",0.5859
Tamburlaine the Great-Part1,MYCETES,SCENE II.,SCENE II.,4,"Go on, my lord, and give your charge, I say;","['Go', 'lord', 'give', 'charge', 'say']",0.0
Tamburlaine the Great-Part1,MYCETES,SCENE II.,SCENE II.,5,Thy wit will make us conquerors to-day.,"['wit', 'make', 'conquerors', 'to-day']",0.0
Tamburlaine the Great-Part1,MEANDER,SCENE II.,SCENE II.,1,"Then, noble soldiers, to entrap these thieves","['noble', 'soldiers', 'entrap', 'thieves']",-0.0772
Tamburlaine the Great-Part1,MEANDER,SCENE II.,SCENE II.,2,"That live confounded in disorder'd troops,","['live', 'confounded', 'disorder', 'troops']",0.0
Tamburlaine the Great-Part1,MEANDER,SCENE II.,SCENE II.,3,"If wealth or riches may prevail with them,","['wealth', 'riches', 'may', 'prevail']",0.765
Tamburlaine the Great-Part1,MEANDER,SCENE II.,SCENE II.,4,"We have our camels laden all with gold,","['camels', 'laden', 'gold']",0.0
Tamburlaine the Great-Part1,MEANDER,SCENE II.,SCENE II.,5,Which you that be but common soldiers,"['common', 'soldiers']",0.0
Tamburlaine the Great-Part1,MEANDER,SCENE II.,SCENE II.,6,Shall fling in every corner of the field;,"['Shall', 'fling', 'every', 'corner', 'field']",0.0
Tamburlaine the Great-Part1,MEANDER,SCENE II.,SCENE II.,7,"And, while the base-born Tartars take it up,","['base-born', 'Tartars', 'take']",0.0
Tamburlaine the Great-Part1,MEANDER,SCENE II.,SCENE II.,8,"You, fighting more for honour than for gold,","['fighting', 'honour', 'gold']",0.3566
Tamburlaine the Great-Part1,MEANDER,SCENE II.,SCENE II.,9,Shall massacre those greedy-minded slaves;,"['Shall', 'massacre', 'greedy-minded', 'slaves']",0.0
Tamburlaine the Great-Part1,MEANDER,SCENE II.,SCENE II.,10,"And, when their scatter'd army is subdu'd,","['scatter', 'army', 'subdu']",0.0
Tamburlaine the Great-Part1,MEANDER,SCENE II.,SCENE II.,11,"And you march on their slaughter'd carcasses,","['march', 'slaughter', 'carcasses']",0.0
Tamburlaine the Great-Part1,MEANDER,SCENE II.,SCENE II.,12,"Share equally the gold that bought their lives,","['Share', 'equally', 'gold', 'bought', 'lives']",0.296
Tamburlaine the Great-Part1,MEANDER,SCENE II.,SCENE II.,13,And live like gentlemen in Persia.,"['live', 'like', 'gentlemen', 'Persia']",0.3612
Tamburlaine the Great-Part1,MEANDER,SCENE II.,SCENE II.,14,"Strike up the  drum, and march courageously:","['Strike', 'drum', 'march', 'courageously']",0.4215
Tamburlaine the Great-Part1,MEANDER,SCENE II.,SCENE II.,15,Fortune herself doth sit upon our crests.,"['Fortune', 'doth', 'sit', 'upon', 'crests']",0.0
Tamburlaine the Great-Part1,MYCETES,SCENE II.,SCENE II.,1,"He tells you true, my masters; so he does.","['tells', 'true', 'masters']",0.4215
Tamburlaine the Great-Part1,MYCETES,SCENE II.,SCENE II.,2,"Drums, why sound ye not when Meander speaks?","['Drums', 'sound', 'Meander', 'speaks']",0.0
Tamburlaine the Great-Part1,MYCETES,SCENE III.,SCENE III.,3,"He tells you true, my masters; so he does.","['tells', 'true', 'masters']",0.4215
Tamburlaine the Great-Part1,MYCETES,SCENE III.,SCENE III.,4,"Drums, why sound ye not when Meander speaks?","['Drums', 'sound', 'Meander', 'speaks']",0.0
Tamburlaine the Great-Part1,MYCETES,SCENE III.,SCENE III.,5,"USUMCASANE,",[],0.0
Tamburlaine the Great-Part1,COSROE,SCENE III.,SCENE III.,1,"Now, worthy Tamburlaine, have I repos'd","['worthy', 'Tamburlaine', 'repos']",0.4404
Tamburlaine the Great-Part1,COSROE,SCENE III.,SCENE III.,2,In thy approved fortunes all my hope.,"['approved', 'fortunes', 'hope']",0.6908
Tamburlaine the Great-Part1,COSROE,SCENE III.,SCENE III.,3,"What think'st thou, man, shall come of our attempts?","[""think'st"", 'man', 'shall', 'come', 'attempts']",0.0
Tamburlaine the Great-Part1,COSROE,SCENE III.,SCENE III.,4,"For, even as from assured oracle,","['even', 'assured', 'oracle']",0.3612
Tamburlaine the Great-Part1,COSROE,SCENE III.,SCENE III.,5,I take thy doom for satisfaction.,"['take', 'doom', 'satisfaction']",0.0516
Tamburlaine the Great-Part1,TAMBURLAINE,SCENE III.,SCENE III.,1,"And so mistake you not a whit, my lord;","['mistake', 'whit', 'lord']",-0.4005
Tamburlaine the Great-Part1,TAMBURLAINE,SCENE III.,SCENE III.,2,For fates and oracles  heaven have sworn,"['fates', 'oracles', 'heaven', 'sworn']",0.5106
Tamburlaine the Great-Part1,TAMBURLAINE,SCENE III.,SCENE III.,3,"To royalize the deeds of Tamburlaine,","['royalize', 'deeds', 'Tamburlaine']",0.0
Tamburlaine the Great-Part1,TAMBURLAINE,SCENE III.,SCENE III.,4,And make them blest that share in his attempts:,"['make', 'blest', 'share', 'attempts']",0.296
Tamburlaine the Great-Part1,TAMBURLAINE,SCENE III.,SCENE III.,5,"And doubt you not but, if you favour me,","['doubt', 'favour']",0.4767
Tamburlaine the Great-Part1,TAMBURLAINE,SCENE III.,SCENE III.,6,And let my fortunes and my valour sway,"['let', 'fortunes', 'valour', 'sway']",0.0
Tamburlaine the Great-Part1,TAMBURLAINE,SCENE III.,SCENE III.,7,"To some  direction in your martial deeds,","['direction', 'martial', 'deeds']",0.0
Tamburlaine the Great-Part1,TAMBURLAINE,SCENE III.,SCENE III.,8,The world will  strive with hosts of men-at-arms,"['world', 'strive', 'hosts', 'men-at-arms']",0.0
Tamburlaine the Great-Part1,TAMBURLAINE,SCENE III.,SCENE III.,9,To swarm unto the ensign I support.,"['swarm', 'unto', 'ensign', 'support']",0.4019
Tamburlaine the Great-Part1,TAMBURLAINE,SCENE III.,SCENE III.,10,"The host of Xerxes, which by fame is said","['host', 'Xerxes', 'fame', 'said']",0.4404
Tamburlaine the Great-Part1,TAMBURLAINE,SCENE III.,SCENE III.,11,"To drink the mighty Parthian Araris,","['drink', 'mighty', 'Parthian', 'Araris']",0.0
Tamburlaine the Great-Part1,TAMBURLAINE,SCENE III.,SCENE III.,12,Was but a handful to that we will have:,['handful'],0.0
Tamburlaine the Great-Part1,TAMBURLAINE,SCENE III.,SCENE III.,13,"Our quivering lances, shaking in the air,","['quivering', 'lances', 'shaking', 'air']",-0.1779
Tamburlaine the Great-Part1,TAMBURLAINE,SCENE III.,SCENE III.,14,"And bullets, like Jove's dreadful thunderbolts,","['bullets', 'like', 'Jove', 'dreadful', 'thunderbolts']",-0.1027
Tamburlaine the Great-Part1,TAMBURLAINE,SCENE III.,SCENE III.,15,"Enroll'd in flames and fiery smouldering mists,","['Enroll', 'flames', 'fiery', 'smouldering', 'mists']",-0.34
Tamburlaine the Great-Part1,TAMBURLAINE,SCENE III.,SCENE III.,16,Shall threat the gods more than Cyclopian wars;,"['Shall', 'threat', 'gods', 'Cyclopian', 'wars']",-0.8055
Tamburlaine the Great-Part1,TAMBURLAINE,SCENE III.,SCENE III.,17,"And with our sun-bright armour, as we march,","['sun-bright', 'armour', 'march']",0.0
Tamburlaine the Great-Part1,TAMBURLAINE,SCENE III.,SCENE III.,18,"We'll chase the stars from heaven, and dim their eyes","['chase', 'stars', 'heaven', 'dim', 'eyes']",0.5106
Tamburlaine the Great-Part1,TAMBURLAINE,SCENE III.,SCENE III.,19,That stand and muse at our admired arms.,"['stand', 'muse', 'admired', 'arms']",0.5106
Tamburlaine the Great-Part1,THERIDAMAS,SCENE III.,SCENE III.,1,"You see, my lord, what working words he hath;","['see', 'lord', 'working', 'words']",0.0
Tamburlaine the Great-Part1,THERIDAMAS,SCENE III.,SCENE III.,2,"But, when you see his actions top  his speech,","['see', 'actions', 'top', 'speech']",0.296
Tamburlaine the Great-Part1,THERIDAMAS,SCENE III.,SCENE III.,3,"Your speech will stay, or so extol his worth","['speech', 'stay', 'extol', 'worth']",0.2878
Tamburlaine the Great-Part1,THERIDAMAS,SCENE III.,SCENE III.,4,As I shall be commended and excus'd,"['shall', 'commended', 'excus']",0.4404
Tamburlaine the Great-Part1,THERIDAMAS,SCENE III.,SCENE III.,5,For turning my poor charge to his direction:,"['turning', 'poor', 'charge', 'direction']",-0.4767
Tamburlaine the Great-Part1,THERIDAMAS,SCENE III.,SCENE III.,6,"And these his two renowmed  friends, my lord,","['two', 'renowmed', 'friends', 'lord']",0.4767
Tamburlaine the Great-Part1,THERIDAMAS,SCENE III.,SCENE III.,7,Would make one thirst  and strive to be retain'd,"['Would', 'make', 'one', 'thirst', 'strive', 'retain']",0.0
Tamburlaine the Great-Part1,THERIDAMAS,SCENE III.,SCENE III.,8,In such a great degree of amity.,"['great', 'degree', 'amity']",0.6249
Tamburlaine the Great-Part1,TECHELLES,SCENE III.,SCENE III.,1,With duty and  with amity we yield,"['duty', 'amity', 'yield']",0.0
Tamburlaine the Great-Part1,TECHELLES,SCENE III.,SCENE III.,2,Our utmost service to the fair  Cosroe.,"['utmost', 'service', 'fair', 'Cosroe']",0.3182
Tamburlaine the Great-Part1,COSROE,SCENE III.,SCENE III.,1,Which I esteem as portion of my crown.,"['esteem', 'portion', 'crown']",0.0
Tamburlaine the Great-Part1,COSROE,SCENE III.,SCENE III.,2,"Usumcasane and Techelles both,","['Usumcasane', 'Techelles']",0.0
Tamburlaine the Great-Part1,COSROE,SCENE III.,SCENE III.,3,"When she  that rules in Rhamnus'  golden gates,","['rules', 'Rhamnus', 'golden', 'gates']",0.0
Tamburlaine the Great-Part1,COSROE,SCENE III.,SCENE III.,4,"And makes a passage for all prosperous arms,","['makes', 'passage', 'prosperous', 'arms']",0.4767
Tamburlaine the Great-Part1,COSROE,SCENE III.,SCENE III.,5,"Shall make me solely emperor of Asia,","['Shall', 'make', 'solely', 'emperor', 'Asia']",0.0
Tamburlaine the Great-Part1,COSROE,SCENE III.,SCENE III.,6,Then shall your meeds  and valours be advanc'd,"['shall', 'meeds', 'valours', 'advanc']",0.0
Tamburlaine the Great-Part1,COSROE,SCENE III.,SCENE III.,7,To rooms of honour and nobility.,"['rooms', 'honour', 'nobility']",0.5719
Tamburlaine the Great-Part1,TAMBURLAINE,SCENE III.,SCENE III.,1,"Then haste, Cosroe, to be king alone,","['haste', 'Cosroe', 'king', 'alone']",-0.25
Tamburlaine the Great-Part1,TAMBURLAINE,SCENE III.,SCENE III.,2,That I with these my friends and all my men,"['friends', 'men']",0.4767
Tamburlaine the Great-Part1,TAMBURLAINE,SCENE III.,SCENE III.,3,May triumph in our long-expected fate.,"['May', 'triumph', 'long-expected', 'fate']",0.4767
Tamburlaine the Great-Part1,TAMBURLAINE,SCENE III.,SCENE III.,4,"The king, your brother, is now hard at hand:","['king', 'brother', 'hard', 'hand']",0.4215
Tamburlaine the Great-Part1,TAMBURLAINE,SCENE III.,SCENE III.,5,"Meet with the fool, and rid your royal shoulders","['Meet', 'fool', 'rid', 'royal', 'shoulders']",-0.4404
Tamburlaine the Great-Part1,TAMBURLAINE,SCENE III.,SCENE III.,6,Of such a burden as outweighs the sands,"['burden', 'outweighs', 'sands']",-0.4404
Tamburlaine the Great-Part1,TAMBURLAINE,SCENE III.,SCENE III.,7,And all the craggy rocks of Caspia.,"['craggy', 'rocks', 'Caspia']",0.0
Tamburlaine the Great-Part1,MESSENGER,SCENE III.,SCENE III.,1,"My lord,",['lord'],0.0
Tamburlaine the Great-Part1,MESSENGER,SCENE III.,SCENE III.,2,We have discovered the enemy,"['discovered', 'enemy']",-0.5423
Tamburlaine the Great-Part1,MESSENGER,SCENE III.,SCENE III.,3,Ready to charge you with a mighty army.,"['Ready', 'charge', 'mighty', 'army']",0.3612
Tamburlaine the Great-Part1,COSROE,SCENE III.,SCENE III.,1,"Come, Tamburlaine; now whet thy winged sword,","['Come', 'Tamburlaine', 'whet', 'winged', 'sword']",0.0
Tamburlaine the Great-Part1,COSROE,SCENE III.,SCENE III.,2,"And lift thy lofty arm into  the clouds,","['lift', 'lofty', 'arm', 'clouds']",0.0
Tamburlaine the Great-Part1,COSROE,SCENE III.,SCENE III.,3,"That it may reach the king of Persia's crown,","['may', 'reach', 'king', 'Persia', 'crown']",0.0258
Tamburlaine the Great-Part1,COSROE,SCENE III.,SCENE III.,4,And set it safe on my victorious head.,"['set', 'safe', 'victorious', 'head']",0.4404
Tamburlaine the Great-Part1,TAMBURLAINE,SCENE III.,SCENE III.,1,"See where it is, the keenest curtle-axe","['See', 'keenest', 'curtle-axe']",0.4404
Tamburlaine the Great-Part1,TAMBURLAINE,SCENE III.,SCENE III.,2,That e'er made passage thorough Persian arms!,"[""e'er"", 'made', 'passage', 'thorough', 'Persian', 'arms']",0.0
Tamburlaine the Great-Part1,TAMBURLAINE,SCENE III.,SCENE III.,3,These are the wings shall make it fly as swift,"['wings', 'shall', 'make', 'fly', 'swift']",0.2023
Tamburlaine the Great-Part1,TAMBURLAINE,SCENE III.,SCENE III.,4,"As doth the lightning or the breath of heaven,","['doth', 'lightning', 'breath', 'heaven']",0.5106
Tamburlaine the Great-Part1,TAMBURLAINE,SCENE III.,SCENE III.,5,And kill as sure  as it swiftly flies.,"['kill', 'sure', 'swiftly', 'flies']",-0.296
Tamburlaine the Great-Part1,COSROE,SCENE III.,SCENE III.,1,Thy words assure me of kind success:,"['words', 'assure', 'kind', 'success']",0.8591
Tamburlaine the Great-Part1,COSROE,SCENE III.,SCENE III.,2,"Go, valiant soldier, go before, and charge","['Go', 'valiant', 'soldier', 'go', 'charge']",0.0
Tamburlaine the Great-Part1,COSROE,SCENE III.,SCENE III.,3,The fainting army of that foolish king.,"['fainting', 'army', 'foolish', 'king']",-0.2732
Tamburlaine the Great-Part1,TAMBURLAINE,SCENE III.,SCENE III.,1,"Usumcasane and Techelles, come:","['Usumcasane', 'Techelles', 'come']",0.0
Tamburlaine the Great-Part1,TAMBURLAINE,SCENE III.,SCENE III.,2,"We are enow to scare the enemy,","['enow', 'scare', 'enemy']",-0.7717
Tamburlaine the Great-Part1,TAMBURLAINE,SCENE III.,SCENE III.,3,And more than needs to make an emperor.,"['needs', 'make', 'emperor']",0.0
Tamburlaine the Great-Part1,TAMBURLAINE,SCENE IV.,SCENE IV.,4,"Usumcasane and Techelles, come:","['Usumcasane', 'Techelles', 'come']",0.0
Tamburlaine the Great-Part1,TAMBURLAINE,SCENE IV.,SCENE IV.,5,"We are enow to scare the enemy,","['enow', 'scare', 'enemy']",-0.7717
Tamburlaine the Great-Part1,TAMBURLAINE,SCENE IV.,SCENE IV.,6,And more than needs to make an emperor.,"['needs', 'make', 'emperor']",0.0
Tamburlaine the Great-Part1,MYCETES,SCENE IV.,SCENE IV.,1,Accurs'd be he that first invented war!,"['Accurs', 'first', 'invented', 'war']",-0.636
Tamburlaine the Great-Part1,MYCETES,SCENE IV.,SCENE IV.,2,"They knew not, ah, they knew not, simple men,","['knew', 'ah', 'knew', 'simple', 'men']",0.0
Tamburlaine the Great-Part1,MYCETES,SCENE IV.,SCENE IV.,3,How those were  hit by pelting cannon-shot,"['hit', 'pelting', 'cannon-shot']",0.0
Tamburlaine the Great-Part1,MYCETES,SCENE IV.,SCENE IV.,4,Stand staggering  like a quivering aspen-leaf,"['Stand', 'staggering', 'like', 'quivering', 'aspen-leaf']",0.3612
Tamburlaine the Great-Part1,MYCETES,SCENE IV.,SCENE IV.,5,Fearing the force of Boreas' boisterous blasts!,"['Fearing', 'force', 'Boreas', 'boisterous', 'blasts']",-0.6114
Tamburlaine the Great-Part1,MYCETES,SCENE IV.,SCENE IV.,6,"In what a lamentable case were I,","['lamentable', 'case']",-0.3612
Tamburlaine the Great-Part1,MYCETES,SCENE IV.,SCENE IV.,7,If nature had not given me wisdom's lore!,"['nature', 'given', 'wisdom', 'lore']",0.0
Tamburlaine the Great-Part1,MYCETES,SCENE IV.,SCENE IV.,8,"For kings are clouts that every man shoots at,","['kings', 'clouts', 'every', 'man', 'shoots']",0.0
Tamburlaine the Great-Part1,MYCETES,SCENE IV.,SCENE IV.,9,Our crown the pin  that thousands seek to cleave:,"['crown', 'pin', 'thousands', 'seek', 'cleave']",0.0
Tamburlaine the Great-Part1,MYCETES,SCENE IV.,SCENE IV.,10,Therefore in policy I think it good,"['Therefore', 'policy', 'think', 'good']",0.4404
Tamburlaine the Great-Part1,MYCETES,SCENE IV.,SCENE IV.,11,"To hide it close; a goodly stratagem,","['hide', 'close', 'goodly', 'stratagem']",-0.1779
Tamburlaine the Great-Part1,MYCETES,SCENE IV.,SCENE IV.,12,And far from any man that is a fool:,"['far', 'man', 'fool']",-0.4404
Tamburlaine the Great-Part1,MYCETES,SCENE IV.,SCENE IV.,13,"So shall not I be known; or if I be,","['shall', 'known']",0.0
Tamburlaine the Great-Part1,MYCETES,SCENE IV.,SCENE IV.,14,They cannot take away my crown from me.,"['take', 'away', 'crown']",0.0
Tamburlaine the Great-Part1,MYCETES,SCENE IV.,SCENE IV.,15,Here will I hide it in this simple hole.,"['hide', 'simple', 'hole']",-0.1779
Tamburlaine the Great-Part1,TAMBURLAINE,SCENE IV.,SCENE IV.,1,"What, fearful coward, straggling from the camp,","['fearful', 'coward', 'straggling', 'camp']",-0.7351
Tamburlaine the Great-Part1,TAMBURLAINE,SCENE IV.,SCENE IV.,2,When kings themselves are present in the field?,"['kings', 'present', 'field']",0.0
Tamburlaine the Great-Part1,MYCETES,SCENE IV.,SCENE IV.,1,Thou liest.,['liest'],0.0
Tamburlaine the Great-Part1,TAMBURLAINE,SCENE IV.,SCENE IV.,1,"Base villain, darest thou give me  the lie?","['Base', 'villain', 'darest', 'give', 'lie']",-0.5574
Tamburlaine the Great-Part1,MYCETES,SCENE IV.,SCENE IV.,1,Away! I am the king; go; touch me not.,"['Away', 'king', 'go', 'touch']",0.0
Tamburlaine the Great-Part1,MYCETES,SCENE IV.,SCENE IV.,2,"Thou break'st the law of arms, unless thou kneel,","[""break'st"", 'law', 'arms', 'unless', 'kneel']",0.0
Tamburlaine the Great-Part1,MYCETES,SCENE IV.,SCENE IV.,3,"And cry me ""mercy, noble king!""","['cry', '``', 'mercy', 'noble', 'king', ""''""]",0.4003
Tamburlaine the Great-Part1,TAMBURLAINE,SCENE IV.,SCENE IV.,1,Are you the witty king of Persia?,"['witty', 'king', 'Persia']",0.0
Tamburlaine the Great-Part1,MYCETES,SCENE IV.,SCENE IV.,1,"Ay, marry,  am I:  have you any suit to me?","['Ay', 'marry', 'suit']",0.0
Tamburlaine the Great-Part1,TAMBURLAINE,SCENE IV.,SCENE IV.,1,I would entreat you to speak but three wise words.,"['would', 'entreat', 'speak', 'three', 'wise', 'words']",0.631
Tamburlaine the Great-Part1,MYCETES,SCENE IV.,SCENE IV.,1,So I can when I see my time.,"['see', 'time']",0.0
Tamburlaine the Great-Part1,TAMBURLAINE,SCENE IV.,SCENE IV.,1,Is this your crown?,['crown'],0.0
Tamburlaine the Great-Part1,MYCETES,SCENE IV.,SCENE IV.,1,Ay:  didst thou ever see a fairer?,"['Ay', 'didst', 'ever', 'see', 'fairer']",0.0
Tamburlaine the Great-Part1,TAMBURLAINE,SCENE IV.,SCENE IV.,1,"You will not sell it, will you?",['sell'],0.0
Tamburlaine the Great-Part1,MYCETES,SCENE IV.,SCENE IV.,1,"Such another word, and I will have thee executed.  Come,","['another', 'word', 'executed', 'Come']",0.0
Tamburlaine the Great-Part1,MYCETES,SCENE IV.,SCENE IV.,2,give it me.,['give'],0.0
Tamburlaine the Great-Part1,TAMBURLAINE,SCENE IV.,SCENE IV.,1,No; I took it prisoner.,"['took', 'prisoner']",-0.5423
Tamburlaine the Great-Part1,MYCETES,SCENE IV.,SCENE IV.,1,You lie; I gave it you.,"['lie', 'gave']",0.0
Tamburlaine the Great-Part1,TAMBURLAINE,SCENE IV.,SCENE IV.,1,Then 'tis mine.,"[""'t""]",0.0
Tamburlaine the Great-Part1,MYCETES,SCENE IV.,SCENE IV.,1,No; I mean I let you keep it.,"['mean', 'let', 'keep']",0.0
Tamburlaine the Great-Part1,TAMBURLAINE,SCENE IV.,SCENE IV.,1,"Well, I mean you shall have it again.","['Well', 'mean', 'shall']",0.2732
Tamburlaine the Great-Part1,TAMBURLAINE,SCENE IV.,SCENE IV.,2,"Here, take it for a while:  I lend it thee,","['take', 'lend']",0.0
Tamburlaine the Great-Part1,TAMBURLAINE,SCENE IV.,SCENE IV.,3,Till I may see thee hemm'd with armed men;,"['Till', 'may', 'see', 'hemm', 'armed', 'men']",0.0
Tamburlaine the Great-Part1,TAMBURLAINE,SCENE IV.,SCENE IV.,4,Then shalt thou see me pull it from thy head:,"['shalt', 'see', 'pull', 'head']",0.0
Tamburlaine the Great-Part1,TAMBURLAINE,SCENE IV.,SCENE IV.,5,Thou art no match for mighty Tamburlaine.,"['match', 'mighty', 'Tamburlaine']",-0.296
