play_name,genre,character,act,scene,sentence,text,tokens,sentiment_score
Richard III,History,Queen Margaret,4,4,73,"And send them thither: but at hand, at hand,","['send', 'thither', 'hand', 'hand']",0.8625
Richard III,History,Queen Margaret,4,4,74,Ensues his piteous and unpitied end:,"['Ensues', 'piteous', 'unpitied', 'end']",-0.296
Richard III,History,Queen Margaret,4,4,75,"Earth gapes, hell burns, fiends roar, saints pray.","['Earth', 'gapes', 'hell', 'burns', 'fiends', 'roar', 'saints', 'pray']",-0.5106
Richard III,History,Queen Margaret,4,4,76,To have him suddenly convey'd away.,"['suddenly', 'convey', 'away']",0.0
Richard III,History,Queen Margaret,4,4,77,"Cancel his bond of life, dear God, I prey,","['Cancel', 'bond', 'life', 'dear', 'God', 'prey']",0.4019
Richard III,History,Queen Margaret,4,4,78,"That I may live to say, The dog is dead!","['may', 'live', 'say', 'dog', 'dead']",-0.68
Richard III,History,Queen Elizabeth,4,4,79,"O, thou didst prophesy the time would come","['didst', 'prophesy', 'time', 'would', 'come']",0.0
Richard III,History,Queen Elizabeth,4,4,80,That I should wish for thee to help me curse,"['wish', 'help', 'curse']",0.2263
Richard III,History,Queen Elizabeth,4,4,81,"That bottled spider, that foul bunch-back'd toad!","['bottled', 'spider', 'foul', 'bunch-back', 'toad']",0.0
Richard III,History,Queen Margaret,4,4,82,I call'd thee then vain flourish of my fortune;,"['call', 'vain', 'flourish', 'fortune']",-0.4215
Richard III,History,Queen Margaret,4,4,83,"I call'd thee then poor shadow, painted queen;","['call', 'poor', 'shadow', 'painted', 'queen']",-0.4767
Richard III,History,Queen Margaret,4,4,84,The presentation of but what I was;,['presentation'],0.0
Richard III,History,Queen Margaret,4,4,85,The flattering index of a direful pageant;,"['flattering', 'index', 'direful', 'pageant']",-0.4215
Richard III,History,Queen Margaret,4,4,86,"One heaved a-high, to be hurl'd down below;","['One', 'heaved', 'a-high', 'hurl']",0.0
Richard III,History,Queen Margaret,4,4,87,A mother only mock'd with two sweet babes;,"['mother', 'mock', 'two', 'sweet', 'babes']",0.4588
Richard III,History,Queen Margaret,4,4,88,"A dream of what thou wert, a breath, a bubble,","['dream', 'wert', 'breath', 'bubble']",0.25
Richard III,History,Queen Margaret,4,4,89,"A sign of dignity, a garish flag,","['sign', 'dignity', 'garish', 'flag']",0.4019
Richard III,History,Queen Margaret,4,4,90,"To be the aim of every dangerous shot,","['aim', 'every', 'dangerous', 'shot']",-0.4767
Richard III,History,Queen Margaret,4,4,91,"A queen in jest, only to fill the scene.","['queen', 'jest', 'fill', 'scene']",0.0
Richard III,History,Queen Margaret,4,4,92,Where is thy husband now? where be thy brothers?,"['husband', 'brothers']",0.0
Richard III,History,Queen Margaret,4,4,93,"Where are thy children? wherein dost thou, joy?","['children', 'wherein', 'joy']",0.6322
Richard III,History,Queen Margaret,4,4,94,Who sues to thee and cries 'God save the queen'?,"['sues', 'cries', ""'God"", 'save', 'queen']",0.3818
Richard III,History,Queen Margaret,4,4,95,Where be the bending peers that flatter'd thee?,"['bending', 'peers', 'flatter']",0.0
Richard III,History,Queen Margaret,4,4,96,Where be the thronging troops that follow'd thee?,"['thronging', 'troops', 'follow']",0.0
Richard III,History,Queen Margaret,4,4,97,"Decline all this, and see what now thou art:","['Decline', 'see']",0.0
Richard III,History,Queen Margaret,4,4,98,"For happy wife, a most distressed widow;","['happy', 'wife', 'distressed', 'widow']",0.1548
Richard III,History,Queen Margaret,4,4,99,"For joyful mother, one that wails the name;","['joyful', 'mother', 'one', 'wails', 'name']",0.5994
Richard III,History,Queen Margaret,4,4,100,"For queen, a very caitiff crown'd with care;","['queen', 'caitiff', 'crown', 'care']",0.4939
Richard III,History,Queen Margaret,4,4,101,"For one being sued to, one that humbly sues;","['one', 'sued', 'one', 'humbly', 'sues']",0.0
Richard III,History,Queen Margaret,4,4,102,"For one that scorn'd at me, now scorn'd of me;","['one', 'scorn', 'scorn']",0.0
Richard III,History,Queen Margaret,4,4,103,"For one being fear'd of all, now fearing one;","['one', 'fear', 'fearing', 'one']",-0.5719
Richard III,History,Queen Margaret,4,4,104,"For one commanding all, obey'd of none.","['one', 'commanding', 'obey', 'none']",0.0
Richard III,History,Queen Margaret,4,4,105,"Thus hath the course of justice wheel'd about,","['Thus', 'course', 'justice', 'wheel']",0.5267
Richard III,History,Queen Margaret,4,4,106,And left thee but a very prey to time;,"['left', 'prey', 'time']",0.0
Richard III,History,Queen Margaret,4,4,107,"Having no more but thought of what thou wert,","['thought', 'wert']",-0.1531
Richard III,History,Queen Margaret,4,4,108,"To torture thee the more, being what thou art.",['torture'],-0.5994
Richard III,History,Queen Margaret,4,4,109,"Thou didst usurp my place, and dost thou not","['didst', 'usurp', 'place']",0.0
Richard III,History,Queen Margaret,4,4,110,Usurp the just proportion of my sorrow?,"['Usurp', 'proportion', 'sorrow']",-0.5267
Richard III,History,Queen Margaret,4,4,111,Now thy proud neck bears half my burthen'd yoke;,"['proud', 'neck', 'bears', 'half', 'burthen', 'yoke']",0.4767
Richard III,History,Queen Margaret,4,4,112,"From which even here I slip my weary neck,","['even', 'slip', 'weary', 'neck']",-0.2732
Richard III,History,Queen Margaret,4,4,113,And leave the burthen of it all on thee.,"['leave', 'burthen']",-0.0516
Richard III,History,Queen Margaret,4,4,114,"Farewell, York's wife, and queen of sad mischance:","['Farewell', 'wife', 'queen', 'sad', 'mischance']",-0.4767
Richard III,History,Queen Margaret,4,4,115,These English woes will make me smile in France.,"['English', 'woes', 'make', 'smile', 'France']",-0.1027
Richard III,History,Queen Elizabeth,4,4,116,"O thou well skill'd in curses, stay awhile,","['well', 'skill', 'curses', 'stay', 'awhile']",0.2732
Richard III,History,Queen Elizabeth,4,4,117,And teach me how to curse mine enemies!,"['teach', 'curse', 'enemies']",-0.7901
Richard III,History,Queen Margaret,4,4,118,"Forbear to sleep the nights, and fast the days;","['Forbear', 'sleep', 'nights', 'fast', 'days']",0.0
Richard III,History,Queen Margaret,4,4,119,Compare dead happiness with living woe;,"['Compare', 'dead', 'happiness', 'living', 'woe']",-0.5423
Richard III,History,Queen Margaret,4,4,120,"Think that thy babes were fairer than they were,","['Think', 'babes', 'fairer']",0.0
Richard III,History,Queen Margaret,4,4,121,And he that slew them fouler than he is:,"['slew', 'fouler']",0.0
Richard III,History,Queen Margaret,4,4,122,Bettering thy loss makes the bad causer worse:,"['Bettering', 'loss', 'makes', 'bad', 'causer', 'worse']",-0.836
Richard III,History,Queen Margaret,4,4,123,Revolving this will teach thee how to curse.,"['Revolving', 'teach', 'curse']",-0.5423
Richard III,History,Queen Elizabeth,4,4,124,"My words are dull; O, quicken them with thine!","['words', 'dull', 'quicken']",-0.4574
Richard III,History,Queen Margaret,4,4,125,"Thy woes will make them sharp, and pierce like mine.","['woes', 'make', 'sharp', 'pierce', 'like']",-0.1027
Richard III,History,Duchess Of York,4,4,126,Why should calamity be full of words?,"['calamity', 'full', 'words']",0.0
Richard III,History,Queen Elizabeth,4,4,127,"Windy attorneys to their client woes,","['Windy', 'attorneys', 'client', 'woes']",-0.4404
Richard III,History,Queen Elizabeth,4,4,128,"Airy succeeders of intestate joys,","['Airy', 'succeeders', 'intestate', 'joys']",0.6705
Richard III,History,Queen Elizabeth,4,4,129,Poor breathing orators of miseries!,"['Poor', 'breathing', 'orators', 'miseries']",-0.7959
Richard III,History,Queen Elizabeth,4,4,130,Let them have scope: though what they do impart,"['Let', 'scope', 'though', 'impart']",0.0
Richard III,History,Queen Elizabeth,4,4,131,"Help not all, yet do they ease the heart.","['Help', 'yet', 'ease', 'heart']",0.8555
Richard III,History,Duchess Of York,4,4,132,"If so, then be not tongue-tied: go with me.","['tongue-tied', 'go']",0.0
Richard III,History,Duchess Of York,4,4,133,And in the breath of bitter words let's smother,"['breath', 'bitter', 'words', 'let', 'smother']",-0.6808
Richard III,History,Duchess Of York,4,4,134,"My damned son, which thy two sweet sons smother'd.","['damned', 'son', 'two', 'sweet', 'sons', 'smother']",0.1027
Richard III,History,Duchess Of York,4,4,135,I hear his drum: be copious in exclaims.,"['hear', 'drum', 'copious', 'exclaims']",0.0
Richard III,History,King Richard Iii,4,4,136,Who intercepts my expedition?,"['intercepts', 'expedition']",0.0
Richard III,History,Duchess Of York,4,4,137,"O, she that might have intercepted thee,","['might', 'intercepted']",0.0
Richard III,History,Duchess Of York,4,4,138,By strangling thee in her accursed womb,"['strangling', 'accursed', 'womb']",0.0
Richard III,History,Duchess Of York,4,4,139,"From all the slaughters, wretch, that thou hast done!","['slaughters', 'wretch', 'done']",0.0
Richard III,History,Queen Elizabeth,4,4,140,"Hidest thou that forehead with a golden crown,","['Hidest', 'forehead', 'golden', 'crown']",0.0
Richard III,History,Queen Elizabeth,4,4,141,"Where should be graven, if that right were right,","['graven', 'right', 'right']",-0.2263
Richard III,History,Queen Elizabeth,4,4,142,"The slaughter of the prince that owed that crown,","['slaughter', 'prince', 'owed', 'crown']",0.0
Richard III,History,Queen Elizabeth,4,4,143,And the dire death of my two sons and brothers?,"['dire', 'death', 'two', 'sons', 'brothers']",-0.7845
Richard III,History,Queen Elizabeth,4,4,144,"Tell me, thou villain slave, where are my children?","['Tell', 'villain', 'slave', 'children']",-0.5574
Richard III,History,Duchess Of York,4,4,145,"Thou toad, thou toad, where is thy brother Clarence?","['toad', 'toad', 'brother']",0.0
Richard III,History,Duchess Of York,4,4,146,"And little Ned Plantagenet, his son?","['little', 'Ned', 'Plantagenet', 'son']",0.0
Richard III,History,Queen Elizabeth,4,4,147,"Where is kind Hastings, Rivers, Vaughan, Grey?",['kind'],0.5574
Richard III,History,King Richard Iii,4,4,148,"A flourish, trumpets! strike alarum, drums!","['flourish', 'trumpets', 'strike', 'alarum', 'drums']",-0.2695
Richard III,History,King Richard Iii,4,4,149,Let not the heavens hear these tell-tale women,"['Let', 'heavens', 'hear', 'tell-tale', 'women']",-0.3089
Richard III,History,King Richard Iii,4,4,150,"Rail on the Lord's enointed: strike, I say!","['Rail', 'Lord', 'enointed', 'strike', 'say']",-0.2003
Richard III,History,King Richard Iii,4,4,151,"Either be patient, and entreat me fair,","['Either', 'patient', 'entreat', 'fair']",0.3182
Richard III,History,King Richard Iii,4,4,152,Or with the clamorous report of war,"['clamorous', 'report', 'war']",-0.5994
Richard III,History,King Richard Iii,4,4,153,Thus will I drown your exclamations.,"['Thus', 'drown', 'exclamations']",-0.5719
Richard III,History,Duchess Of York,4,4,154,Art thou my son?,['son'],0.0
Richard III,History,King Richard Iii,4,4,155,"Ay, I thank God, my father, and yourself.","['Ay', 'thank', 'God', 'father']",0.5574
Richard III,History,Duchess Of York,4,4,156,Then patiently hear my impatience.,"['patiently', 'hear', 'impatience']",-0.4215
Richard III,History,King Richard Iii,4,4,157,"Madam, I have a touch of your condition,","['Madam', 'touch', 'condition']",0.0
Richard III,History,King Richard Iii,4,4,158,Which cannot brook the accent of reproof.,"['brook', 'accent', 'reproof']",0.0
Richard III,History,Duchess Of York,4,4,159,"O, let me speak!","['let', 'speak']",0.0
Richard III,History,King Richard Iii,4,4,160,Do then: but I'll not hear.,['hear'],0.0
Richard III,History,Duchess Of York,4,4,161,I will be mild and gentle in my speech.,"['mild', 'gentle', 'speech']",0.4404
Richard III,History,King Richard Iii,4,4,162,"And brief, good mother; for I am in haste.","['brief', 'good', 'mother', 'haste']",0.4404
Richard III,History,Duchess Of York,4,4,163,"Art thou so hasty? I have stay'd for thee,","['hasty', 'stay']",0.0
Richard III,History,Duchess Of York,4,4,164,"God knows, in anguish, pain and agony.","['God', 'knows', 'anguish', 'pain', 'agony']",-0.836
Richard III,History,King Richard Iii,4,4,165,And came I not at last to comfort you?,"['came', 'last', 'comfort']",0.3612
Richard III,History,Duchess Of York,4,4,166,"No, by the holy rood, thou know'st it well,","['holy', 'rood', ""know'st"", 'well']",0.2732
Richard III,History,Duchess Of York,4,4,167,Thou camest on earth to make the earth my hell.,"['camest', 'earth', 'make', 'earth', 'hell']",-0.6808
Richard III,History,Duchess Of York,4,4,168,A grievous burthen was thy birth to me;,"['grievous', 'burthen', 'birth']",-0.4588
Richard III,History,Duchess Of York,4,4,169,Tetchy and wayward was thy infancy;,"['Tetchy', 'wayward', 'infancy']",0.0
Richard III,History,Duchess Of York,4,4,170,"Thy school-days frightful, desperate, wild, and furious,","['school-days', 'frightful', 'desperate', 'wild', 'furious']",-0.8519
Richard III,History,Duchess Of York,4,4,171,"Thy prime of manhood daring, bold, and venturous,","['prime', 'manhood', 'daring', 'bold', 'venturous']",0.6249
Richard III,History,Duchess Of York,4,4,172,"Thy age confirm'd, proud, subdued, bloody,","['age', 'confirm', 'proud', 'subdued', 'bloody']",0.0516
Richard III,History,Duchess Of York,4,4,173,"treacherous,",['treacherous'],0.0
Richard III,History,Duchess Of York,4,4,174,"More mild, but yet more harmful, kind in hatred:","['mild', 'yet', 'harmful', 'kind', 'hatred']",-0.198
Richard III,History,Duchess Of York,4,4,175,"What comfortable hour canst thou name,","['comfortable', 'hour', 'canst', 'name']",0.5106
Richard III,History,Duchess Of York,4,4,176,That ever graced me in thy company?,"['ever', 'graced', 'company']",0.2263
Richard III,History,King Richard Iii,4,4,177,"Faith, none, but Humphrey Hour, that call'd","['Faith', 'none', 'Humphrey', 'Hour', 'call']",0.2263
Richard III,History,King Richard Iii,4,4,178,your grace,['grace'],0.4215
Richard III,History,King Richard Iii,4,4,179,To breakfast once forth of my company.,"['breakfast', 'forth', 'company']",0.0
Richard III,History,King Richard Iii,4,4,180,"If I be so disgracious in your sight,","['disgracious', 'sight']",0.0
Richard III,History,King Richard Iii,4,4,181,"Let me march on, and not offend your grace.","['Let', 'march', 'offend', 'grace']",-0.1139
Richard III,History,King Richard Iii,4,4,182,Strike the drum.,"['Strike', 'drum']",-0.128
Richard III,History,Duchess Of York,4,4,183,"I prithee, hear me speak.","['prithee', 'hear', 'speak']",0.0
Richard III,History,King Richard Iii,4,4,184,You speak too bitterly.,"['speak', 'bitterly']",-0.4588
Richard III,History,Duchess Of York,4,4,185,Hear me a word;,"['Hear', 'word']",0.0
Richard III,History,Duchess Of York,4,4,186,For I shall never speak to thee again.,"['shall', 'never', 'speak']",0.0
Richard III,History,King Richard Iii,4,4,187,So.,[],0.0
Richard III,History,Duchess Of York,4,4,188,"Either thou wilt die, by God's just ordinance,","['Either', 'wilt', 'die', 'God', 'ordinance']",-0.5994
Richard III,History,Duchess Of York,4,4,189,"Ere from this war thou turn a conqueror,","['war', 'turn', 'conqueror']",-0.6833
Richard III,History,Duchess Of York,4,4,190,Or I with grief and extreme age shall perish,"['grief', 'extreme', 'age', 'shall', 'perish']",-0.4939
Richard III,History,Duchess Of York,4,4,191,And never look upon thy face again.,"['never', 'look', 'upon', 'face']",0.0
Richard III,History,Duchess Of York,4,4,192,Therefore take with thee my most heavy curse;,"['Therefore', 'take', 'heavy', 'curse']",-0.5829
Richard III,History,Duchess Of York,4,4,193,"Which, in the day of battle, tire thee more","['day', 'battle', 'tire']",-0.3818
Richard III,History,Duchess Of York,4,4,194,Than all the complete armour that thou wear'st!,"['complete', 'armour', ""wear'st""]",0.0
Richard III,History,Duchess Of York,4,4,195,My prayers on the adverse party fight;,"['prayers', 'adverse', 'party', 'fight']",-0.34
Richard III,History,Duchess Of York,4,4,196,And there the little souls of Edward's children,"['little', 'souls', 'Edward', 'children']",0.0
Richard III,History,Duchess Of York,4,4,197,Whisper the spirits of thine enemies,"['Whisper', 'spirits', 'enemies']",-0.4939
Richard III,History,Duchess Of York,4,4,198,And promise them success and victory.,"['promise', 'success', 'victory']",0.7184
Richard III,History,Duchess Of York,4,4,199,"Bloody thou art, bloody will be thy end;","['Bloody', 'bloody', 'end']",-0.7003
Richard III,History,Duchess Of York,4,4,200,Shame serves thy life and doth thy death attend.,"['Shame', 'serves', 'life', 'doth', 'death', 'attend']",-0.7906
Richard III,History,Queen Elizabeth,4,4,201,"Though far more cause, yet much less spirit to curse","['Though', 'far', 'cause', 'yet', 'much', 'less', 'spirit', 'curse']",-0.4271
Richard III,History,Queen Elizabeth,4,4,202,Abides in me; I say amen to all.,"['Abides', 'say', 'amen']",0.0
Richard III,History,King Richard Iii,4,4,203,"Stay, madam; I must speak a word with you.","['Stay', 'madam', 'must', 'speak', 'word']",0.0
Richard III,History,Queen Elizabeth,4,4,204,I have no more sons of the royal blood,"['sons', 'royal', 'blood']",-0.296
Richard III,History,Queen Elizabeth,4,4,205,"For thee to murder: for my daughters, Richard,","['murder', 'daughters', 'Richard']",-0.6908
Richard III,History,Queen Elizabeth,4,4,206,"They shall be praying nuns, not weeping queens;","['shall', 'praying', 'nuns', 'weeping', 'queens']",0.6002
Richard III,History,Queen Elizabeth,4,4,207,And therefore level not to hit their lives.,"['therefore', 'level', 'hit', 'lives']",0.0
Richard III,History,King Richard Iii,4,4,208,"You have a daughter call'd Elizabeth,","['daughter', 'call', 'Elizabeth']",0.0
Richard III,History,King Richard Iii,4,4,209,"Virtuous and fair, royal and gracious.","['Virtuous', 'fair', 'royal', 'gracious']",0.8519
Richard III,History,Queen Elizabeth,4,4,210,"And must she die for this? O, let her live,","['must', 'die', 'let', 'live']",-0.5994
Richard III,History,Queen Elizabeth,4,4,211,"And I'll corrupt her manners, stain her beauty;","['corrupt', 'manners', 'stain', 'beauty']",0.5859
Richard III,History,Queen Elizabeth,4,4,212,Slander myself as false to Edward's bed;,"['Slander', 'false', 'Edward', 'bed']",0.0
Richard III,History,Queen Elizabeth,4,4,213,Throw over her the veil of infamy:,"['Throw', 'veil', 'infamy']",0.0
Richard III,History,Queen Elizabeth,4,4,214,"So she may live unscarr'd of bleeding slaughter,","['may', 'live', 'unscarr', 'bleeding', 'slaughter']",0.0
Richard III,History,Queen Elizabeth,4,4,215,I will confess she was not Edward's daughter.,"['confess', 'Edward', 'daughter']",0.0
Richard III,History,King Richard Iii,4,4,216,"Wrong not her birth, she is of royal blood.","['Wrong', 'birth', 'royal', 'blood']",-0.4767
Richard III,History,Queen Elizabeth,4,4,217,"To save her life, I'll say she is not so.","['save', 'life', 'say']",0.4939
Richard III,History,King Richard Iii,4,4,218,Her life is only safest in her birth.,"['life', 'safest', 'birth']",0.4019
Richard III,History,Queen Elizabeth,4,4,219,And only in that safety died her brothers.,"['safety', 'died', 'brothers']",-0.2023
Richard III,History,King Richard Iii,4,4,220,"Lo, at their births good stars were opposite.","['Lo', 'births', 'good', 'stars', 'opposite']",0.4404
Richard III,History,Queen Elizabeth,4,4,221,"No, to their lives bad friends were contrary.","['lives', 'bad', 'friends', 'contrary']",-0.1027
Richard III,History,King Richard Iii,4,4,222,All unavoided is the doom of destiny.,"['unavoided', 'doom', 'destiny']",-0.4019
Richard III,History,Queen Elizabeth,4,4,223,"True, when avoided grace makes destiny:","['True', 'avoided', 'grace', 'makes', 'destiny']",0.4939
Richard III,History,Queen Elizabeth,4,4,224,"My babes were destined to a fairer death,","['babes', 'destined', 'fairer', 'death']",-0.5994
Richard III,History,Queen Elizabeth,4,4,225,If grace had bless'd thee with a fairer life.,"['grace', 'bless', 'fairer', 'life']",0.4215
Richard III,History,King Richard Iii,4,4,226,You speak as if that I had slain my cousins.,"['speak', 'slain', 'cousins']",0.0
Richard III,History,Queen Elizabeth,4,4,227,"Cousins, indeed; and by their uncle cozen'd","['Cousins', 'indeed', 'uncle', 'cozen']",0.0
Richard III,History,Queen Elizabeth,4,4,228,"Of comfort, kingdom, kindred, freedom, life.","['comfort', 'kingdom', 'kindred', 'freedom', 'life']",0.7717
Richard III,History,Queen Elizabeth,4,4,229,"Whose hand soever lanced their tender hearts,","['Whose', 'hand', 'soever', 'lanced', 'tender', 'hearts']",0.8176
Richard III,History,Queen Elizabeth,4,4,230,"Thy head, all indirectly, gave direction:","['head', 'indirectly', 'gave', 'direction']",0.0
Richard III,History,Queen Elizabeth,4,4,231,No doubt the murderous knife was dull and blunt,"['doubt', 'murderous', 'knife', 'dull', 'blunt']",-0.6994
Richard III,History,Queen Elizabeth,4,4,232,"Till it was whetted on thy stone-hard heart,","['Till', 'whetted', 'stone-hard', 'heart']",0.6369
Richard III,History,Queen Elizabeth,4,4,233,To revel in the entrails of my lambs.,"['revel', 'entrails', 'lambs']",0.0
Richard III,History,Queen Elizabeth,4,4,234,"But that still use of grief makes wild grief tame,","['still', 'use', 'grief', 'makes', 'wild', 'grief', 'tame']",-0.8625
Richard III,History,Queen Elizabeth,4,4,235,My tongue should to thy ears not name my boys,"['tongue', 'ears', 'name', 'boys']",0.0
Richard III,History,Queen Elizabeth,4,4,236,Till that my nails were anchor'd in thine eyes;,"['Till', 'nails', 'anchor', 'eyes']",0.0
Richard III,History,Queen Elizabeth,4,4,237,"And I, in such a desperate bay of death,","['desperate', 'bay', 'death']",-0.7351
Richard III,History,Queen Elizabeth,4,4,238,"Like a poor bark, of sails and tackling reft,","['Like', 'poor', 'bark', 'sails', 'tackling', 'reft']",-0.1531
Richard III,History,Queen Elizabeth,4,4,239,Rush all to pieces on thy rocky bosom.,"['Rush', 'pieces', 'rocky', 'bosom']",0.0
Richard III,History,King Richard Iii,4,4,240,"Madam, so thrive I in my enterprise","['Madam', 'thrive', 'enterprise']",0.0
Richard III,History,King Richard Iii,4,4,241,"And dangerous success of bloody wars,","['dangerous', 'success', 'bloody', 'wars']",-0.7096
Richard III,History,King Richard Iii,4,4,242,"As I intend more good to you and yours,","['intend', 'good']",0.4927
Richard III,History,King Richard Iii,4,4,243,Than ever you or yours were by me wrong'd!,"['ever', 'wrong']",0.0
Richard III,History,Queen Elizabeth,4,4,244,"What good is cover'd with the face of heaven,","['good', 'cover', 'face', 'heaven']",0.7351
Richard III,History,Queen Elizabeth,4,4,245,"To be discover'd, that can do me good?","['discover', 'good']",0.4404
Richard III,History,King Richard Iii,4,4,246,"The advancement of your children, gentle lady.","['advancement', 'children', 'gentle', 'lady']",0.4404
Richard III,History,Queen Elizabeth,4,4,247,"Up to some scaffold, there to lose their heads?","['scaffold', 'lose', 'heads']",-0.4019
Richard III,History,King Richard Iii,4,4,248,"No, to the dignity and height of honour","['dignity', 'height', 'honour']",0.7506
Richard III,History,King Richard Iii,4,4,249,The high imperial type of this earth's glory.,"['high', 'imperial', 'type', 'earth', 'glory']",0.5423
Richard III,History,Queen Elizabeth,4,4,250,Flatter my sorrows with report of it;,"['Flatter', 'sorrows', 'report']",-0.296
Richard III,History,Queen Elizabeth,4,4,251,"Tell me what state, what dignity, what honour,","['Tell', 'state', 'dignity', 'honour']",0.7506
Richard III,History,Queen Elizabeth,4,4,252,Canst thou demise to any child of mine?,"['Canst', 'demise', 'child']",0.0
Richard III,History,King Richard Iii,4,4,253,"Even all I have; yea, and myself and all,","['Even', 'yea']",0.0
Richard III,History,King Richard Iii,4,4,254,Will I withal endow a child of thine;,"['withal', 'endow', 'child']",0.0
Richard III,History,King Richard Iii,4,4,255,So in the Lethe of thy angry soul,"['Lethe', 'angry', 'soul']",-0.5106
Richard III,History,King Richard Iii,4,4,256,Thou drown the sad remembrance of those wrongs,"['drown', 'sad', 'remembrance', 'wrongs']",-0.7783
Richard III,History,King Richard Iii,4,4,257,Which thou supposest I have done to thee.,"['supposest', 'done']",0.0
Richard III,History,Queen Elizabeth,4,4,258,"Be brief, lest that be process of thy kindness","['brief', 'lest', 'process', 'kindness']",0.4588
Richard III,History,Queen Elizabeth,4,4,259,Last longer telling than thy kindness' date.,"['Last', 'longer', 'telling', 'kindness', 'date']",0.4588
Richard III,History,King Richard Iii,4,4,260,"Then know, that from my soul I love thy daughter.","['know', 'soul', 'love', 'daughter']",0.6369
Richard III,History,Queen Elizabeth,4,4,261,My daughter's mother thinks it with her soul.,"['daughter', 'mother', 'thinks', 'soul']",0.0
Richard III,History,King Richard Iii,4,4,262,What do you think?,['think'],0.0
Richard III,History,Queen Elizabeth,4,4,263,That thou dost love my daughter from thy soul:,"['love', 'daughter', 'soul']",0.6369
Richard III,History,Queen Elizabeth,4,4,264,So from thy soul's love didst thou love her brothers;,"['soul', 'love', 'didst', 'love', 'brothers']",0.8555
Richard III,History,Queen Elizabeth,4,4,265,And from my heart's love I do thank thee for it.,"['heart', 'love', 'thank']",0.7717
Richard III,History,King Richard Iii,4,4,266,Be not so hasty to confound my meaning:,"['hasty', 'confound', 'meaning']",0.0
Richard III,History,King Richard Iii,4,4,267,"I mean, that with my soul I love thy daughter,","['mean', 'soul', 'love', 'daughter']",0.6369
Richard III,History,King Richard Iii,4,4,268,And mean to make her queen of England.,"['mean', 'make', 'queen', 'England']",0.0
Richard III,History,Queen Elizabeth,4,4,269,"Say then, who dost thou mean shall be her king?","['Say', 'mean', 'shall', 'king']",0.0
